,id,star,comment,sentiment,snlp_result
6746,633706,8,好多 小吃 挺 高档 价格 挺 实惠 ,1,1
6747,179408908,4,分量 感觉 好吃 ,0,1
6748,156627448,6,吃饭 值得 推荐 ,1,1
6749,107382571,6,味道 不错 去过 东南亚 正 正宗 反正 吃 挺不错 性价比 不算 高   便宜 特别 好吃 那种 装修 好看 环境 挺 干净 卫生 去过 两次 酸甜 好吃 有钱 哈哈哈 ,1,1
6750,73798971,8,环境 装修 很漂亮 份量 很足 每次 吃不完 服务 有求必应 赞 ,1,1
6751,5638032,8,胃口 吃 挺 胃口 不错 ,1,1
6753,4739416,7,吃 两三次 ,1,1
6754,633706,8,不错 味道 上菜 很快 赞 ,1,1
6755,117225790,6,番茄酱 面 喜欢 q 全部都是 番 菠萝包 好吃 ,1,1
6756,5638032,8,周五 晚去 光明 广场 分点 点半到 不算 太 空位 不用 等位 坐下 点 完菜 人来 好像 一下子 坐满 等位 庆幸 早 一点 点 新品 豆腐皮 土鸡 味道 还过得去 免辣 估计 吃 辣 味道 浓 一点 皮蛋 杂菜 煲 味道 咸了 一点 猪肉 饺子 还好 意外 他家 红豆饼 特别 好吃 皮脆 红豆 味道 特 好吃 本来 吃饱 红豆饼 打包 两人 好吃 一下子 吃 完 真的 吃 太饱 ,1,1
6758,74582725,8,榴莲 烤完 特别 清甜 真的 美味 ,1,1
6761,119357852,8,环境 不错 味道 一流 小朋友 爱 ,1,1
6762,86045,8,食物 质量 算 到位 ,1,1
6763,633706,8,性价比 总 味道 行 牛扒 鲜嫩 ,1,1
6764,73798971,8,好吃 分量 很足   牛排 套餐   罗宋汤 玉米汤   腓力 牛扒 ,1,1
6766,2501098,8,女朋友 喜欢 吃 烤鱼 ,1,1
6767,633706,8,不错 两个 吃 味道 不错 ,1,1
6768,5527472,8,特别 好吃 喜欢 黄记煌 妈妈 每次 吃 一份 ,1,1
6769,5638032,8,团过 几次 美味可口 服务 热情 环境 清静 小朋友 喜爱 赠送 水蛋 小朋友 环境 清静 候位 时间 稍长 ,1,1
6770,4739416,8,真心 不错 食量 刚刚 鱼生 厚切 下次 还会来 ,1,1
6772,5638032,8,位置 找到 高峰 排队 挺快 上菜 速度 中等 菜量 稍微 多一点 铁棍 淮山 口感 不错 水晶 粉 味道 美中不足 店铺 空调 吃 热 靠近 门口 原因 铁板烧 水晶 粉 ## 荞麦 茶 ## 香 烤鸡 翅 ## 铁棍 淮山 ## 红豆 薏米 粥 ## 金瓜 小米粥 ,1,1
6773,633706,7,第三次 味道 依然 朋友 吃 餐厅 环境 温馨 灯光 明亮 光线 感觉 咖啡厅 味道 疲惫 身心 放松 牛排 速度 超快 服务生 添 茶水 用餐 完后 门口 招待 客气 说 下次 光临 服务 没话说 价钱 服务 菜品 光临 ,1,1
6775,5527472,7,味道 不错 值得 推荐 ,1,1
6777,633706,4,上菜 羊肉串 吃 冷掉 奶黄 包不太 好吃 柠檬茶 热 好喝 金牌 香 煎 脆皮 鸡排   喜欢 吃 鸡排 三个 吃 分量 三个 男生 刚刚 两个 女生 加 男生 留下 挺 汤 每人 留 一半 满意 服务态度 下次 还会来 ,0,1
6779,5638032,8,喜欢 吃 这家 面 刀削面 拉面 面   弹性 汤底 香醇 配 两块 酱 骨架 完美 一顿饭 ,1,1
6781,2501098,8,服务 环境 不错 好吃 ,1,1
6782,5527472,6,口味 环境 一点 不好 强制 每一锅 点 三道 荤菜 ,1,1
6784,633706,8,东西 不错 吃 很饱 份量 够 配面 意 面 好吃 不用 排队 环境 热 挺 吃 肉 肉 价 真的 值 ,1,1
6786,633706,8,  台湾 风味   牛扒 很正   茶 香 ,1,1
6789,4739416,8,棒棒 哒 第四次 便宜 料 足 ,1,1
6791,86045,6,环境 算 不错 香菜 口味 少 点 ,1,1
6792,633706,8,来过 不知 次 感觉 超级 分量 吃 很饱 ,1,1
6794,5527472,6,口味 一般般 价格 稍微 贵 ,1,1
6795,633706,6,味道 上菜 慢 总体 满意 ,1,1
6796,5638032,4,一般般 酸菜鱼 地道 羊肉 太腥 ,0,1
6798,2501098,6,服务 价位 高 总体 ok ,1,1
6800,158754521,8,环境 看着 好吃 ,1,1
6802,179658375,8,很赞 两个 吃 刚刚 服务员 哥哥 力 赞 ,1,1
6804,164166476,8,不错 一家 店子   口味   饮料 送错 ,1,1
6807,73798971,6,服务 还好 出品 口味 价格 实惠 套餐 点 ,1,1
6808,2501098,8,好吃 态度 环境卫生 不错 好评 ,1,1
6809,73798971,8,价廉物美 ,1,1
6810,633706,6,感觉 一般般 喜欢 服务 ,1,1
6811,73798971,8,努力 加油 做 更好 ,1,1
6812,633706,6,份量 奶黄包 干巴巴 ,1,1
6814,107377267,2,  蟹 辣 服务员 未 我点 微辣 平常 吃 中辣 广东 很辣 辣     吃 第一口 蟹 辣 蟹 新鲜 肯定 急冻 蟹 死 评论者 说肉梅 梅 海鲜 控能 吃 新鲜 新鲜 区别   新鲜 蟹肉 口感 肉 实   主锅 份量 大锅 份 底下 配菜   整一锅数 鸡爪 鸡爪 香辣蟹 牛蛙 香辣蟹   环境 不错 饮料 不错 不介意 口感 味道 无功 无过 我会 第二次 点 牛蛙 蟹 ,0,1
6815,633706,8,真不错 下次 还来 周末 提前 预约 ,1,1
6818,164661961,5,服务员 小哥 好看 ,0,1
6819,73798971,8,扒 味道 不错 粉不太 入味 甜不辣 好吃 炸豆腐 不错 椰果 冰 西瓜 冰 好喝 服务 环境 ,1,1
6820,633706,5,行 ,0,1
6821,633706,8,不错 感觉 挺 价格 适中 ,1,1
6822,73798971,8,环境 OK 出品 优惠 ● ● ● ● ,1,1
6823,633706,8,不错 ,1,1
6825,90908955,6,猫 好像 20 可爱 冬天 动 做 安静 萌宠 ,1,1
6826,73798971,8,味道 不错 环境 量 足 吃 满意   牛排 套餐 ,1,1
6827,4739416,6,不失 环境 尚可 位置 窄 上菜 速度 ,1,1
6828,633706,8,菜品   服务 周到   环境 不错 ,1,1
6829,5638032,8,服务 主动 会帮 追菜 快点 味道 不错 大爱 水晶 粉 ,1,1
6831,73798971,6,分量 挺 豆腐 朋友 喜欢 吃 无感 ,1,1
6832,2501098,8,口味 环境 不错 暂 ,1,1
6833,5527472,8,味道 不错 感觉 东西 少 点 甜品 挺好吃 ,1,1
6834,2501098,8,两次 总体 感觉 不错 ,1,1
6835,73798971,8,好吃 好吃   实惠 实惠   环境 服务 热情 ,1,1
6837,633706,8,适合 约会 ,1,1
6838,5638032,5,一般般 不失 麻烦 收银台 验证 团购 号 ,0,1
6840,2501098,8,真的 不错 两个 分量 吃 撑 服务员 态度 下次 还会 ,1,1
6841,5638032,8,特价 抢购 100 元卖 60 超值 东西 两人 100 够 ,1,1
6843,2501098,8,干净 服务态度 挺 味道 不错 ,1,1
6844,73798971,8,口味 不错 划算 地点 好找 环境 不错 ,1,1
6845,633706,8,老板       享受 生活       机会 还会 ,1,1
6846,73798971,6,大众化 西餐 牛排 份量 稍 小吃 行 ,1,1
6849,633706,8,性价比 超高 牛排 不错 一家人 买 团购 桌子 好吃 小朋友 开心 ,1,1
6850,633706,8,不错   经济 实惠   上菜 速度 ,1,1
6851,633706,8,算 值     地段 价格 ,1,1
6852,633706,8,味道 不错 先上 汤 餐包 饮料 牛排 汤 味道 赞 牛排 猪排 好吃 猪扒 换成 类似 番薯 饼 东西 味道 经理 和蔼可亲 问 需不需要 东西 吃 完 牛排 吃 沙拉 腻 很饱 环境 不错 建议 早 一点 十二点 多人 ,1,1
6854,73798971,8,恒 好吃   分量 足   两个 吃   饮料 好喝 ,1,1
6855,73798971,8,总体 感觉 还行 环境 中等 服务 还好 地点 找 ,1,1
6858,73798971,6,环境 不错 服务态度 吃 东西 感觉 一般般 ,1,1
6860,633706,8,环境 味道 好好 快乐 ,1,1
6861,73798971,8,整体 感觉 不错 周一 中午 12 点多来 ,1,1
6862,633706,8,挺 味道 不错 第一次 我姐 总共 团购 两份 双人 套餐 下次 ,1,1
6863,90908955,8,不错 猫来 围攻 男生 抵抗力 嘻嘻 字 赞 ,1,1
6865,73798971,6,环境 不错 东西 吃饱 ,1,1
6866,633706,8,分量 很足 味道 服务 工作人员 礼貌 不错 ,1,1
6867,119357852,8,不错 ,1,1
6868,5527472,7,吃 几次 点 微辣 太辣 ,1,1
6869,633706,8,不错 挺 分量 足 吃不完 ,1,1
6870,5527472,5,第一次 尝试 感觉 一般般 跟着 潮流 效应 价钱 偏贵 懂得 欣赏 两张 优惠卷 ,0,1
6873,73798971,8,第一次 环境 吸引 团购 牛排 套餐 划算 抵食 不贵 服务态度 一级 棒 ,1,1
6874,73798971,8,两个 吃 浪漫 情侣 拍拖 吃饭 地方 ,1,1
6875,4739416,2,二十分钟 赶着 坐车 吃 很快 食材 新鲜 饭 凉 也许 寿司 饭 本来 凉 早 这样的话 吃 寿司 总体 挺好吃 卖相 ,0,1
6876,73798971,8,真的 好吃 ,1,1
6877,5527472,6,味道 服务 不错 总体 ,1,1
6878,4739416,7,性价比 高 出品 新鲜 团购 便宜 下次 还来 ,1,1
6879,633706,8,分量 很足 味道 不错 这家 店 吃 几次 赞赞赞 ,1,1
6881,86045,8,好吃 菜式 样样 想 吃 揽住 个肚 落楼 ,1,1
6884,633706,8,服务 菜 分量 ,1,1
6885,633706,8,环境 不错 不错 不错 不错 ,1,1
6886,73798971,8,顾客 合 大众 口味 服务员 礼貌 赞 ,1,1
6888,179453956,8,不错 感觉 最有 特色 一架 钢琴 洗手间 哈哈哈 哈哈哈 ,1,1
6889,5527472,6,不错 还会常 小贵 ,1,1
6890,107377267,8,好吃 服务 优惠 ,1,1
6891,160789530,8,菜品 特色 服务 一流 环境 优雅 ,1,1
6894,5527472,7,挺好吃 小贵 服务员 帮 拍照 ,1,1
6895,2501098,8,第二次 买 挺 等位 久 ,1,1
6896,86045,8,不错 ,1,1
6897,107377267,4,螃蟹 好像 新鲜 味道 偏咸 吃螃蟹 季节 螃蟹 好瘦 ,0,1
6898,107377267,6,服务   吃 牛蛙 套餐   价格 不算 贵   值得 推荐   ,1,1
6900,2501098,6,不错 菜品 价格 贵 美团券 价格 小碟 夫妻 肺片 52 元 语 ,1,1
6903,73798971,7,环境 不错 菜品 不错 还会 ,1,1
6904,86045,5,经典 款 手机 震动 end   多久 内心 蝴蝶结 ,0,1
6907,633706,7,好多 团购 上菜 很快 味道 不难 吃 东西 挺 ,1,1
6908,73798971,8,环境 不错 价格 实惠 分量 挺足 ,1,1
6912,73798971,8,价格 唔 太贵 优惠 服务 唔 系 几好 下午 630 一点 餐 餐 已点 时 有位 靓女 罗 左 两杯 柠檬茶 甘 左野 饮 肯定 餐单 落 左 噶 点知 左 半个 钟头 仲未 牛扒 睇 睇 隔离 迟过 晒 食 仲 未有 得食 左位 靓仔 睇 睇 罗 左张 单去 电脑 睇 左下 住 问 讲杯 野系 定系 人罗 我话 人罗 住 靓仔 甘 冇 理由 冇 落单 噶 住 走开 一句 唔 好意思 冇 我顶 左 半个 钟头 一句 唔 好意思 冇 喔 甘个 靓仔 好快 确认 左 张单 牛扒 但系 D 汤 系要 问先 肯罗 地系 第一次 噶 仲有 无线 wifi 好慢 好慢 唔 知系 米 坐个 位入 济 ,1,1
6913,74582725,7,环境 服务 热情 食物 太 特别 前 菜 ,1,1
6914,73798971,8,第二次 感觉 不错 还好 下次 ,1,1
6915,633706,8,划算 味道 还过得去 值得 推荐 一分钱 一分货 ,1,1
6916,633706,8,位置 优越 环境 口感 服务 很棒 ,1,1
6917,633706,8,环境 不错 口味 牛排 份量 足够 孩子 吃 ,1,1
6918,5638032,8,口感 不错 挺好吃 赞 下次 还来 ,1,1
6919,5527472,8,味道 不错 环境 挺 安静 服务 ,1,1
6920,107377267,8,环境 挺 ,1,1
6921,67446384,8,味道 不错 好吃 超值 下次 ,1,1
6922,5527472,4,店 口味 性价比 低 说不上 难吃 想 欲望 重复 ,0,1
6923,73798971,8,一如既往 次来 吃 ,1,1
6924,633706,9,一家人 吃 老板 门口 迎宾 长得 好像 蔡康永 牛扒 很大 块 好吃 ,1,1
6925,633706,8,分量 依旧 足 牛排 变更 大份 32 个赞 ,1,1
6927,74582725,8,挺好吃 上菜 速度 挺快 环境 ,1,1
6928,5527472,8,味道 不错   环境   少   挺 喜欢 清静 ,1,1
6930,164409108,8,店员 服务 主动 周到   烤肉 烤 成熟 合适 口感 吃 添加 酱汁 ,1,1
6931,73798971,8,找 不用 等位 上菜 速度 环境 不错 ,1,1
6932,2501098,8,鱼 香 好吃 朋友 聚会 逛街 吃饭 几次 ,1,1
6933,107377267,8,环境 喜欢 氛围 肉蟹 煲 份量 很足 味道 下次 机会 还会来 ● ● ,1,1
6934,172239782,8,店长 告诉 说 喝汤 番茄 鱼 差点 汤全 喝 确实 熬出来 汤 北京路 步行街 价位 出品 确实 性价比 超高 一盒 清补凉 浓浓的 儿时 回忆 很赞 希望 老板 质量 下次 还会 别升价 ,1,1
6935,158754521,4,大有   服务 细心   不像 别家 还会 有人 收骨蝶 发 牙签   加水   果汁 金桔 柠檬 味   不酸不甜   感觉 喝 冰冷 水   煲 里 小菜 明明 点 豆腐   我加   希望 真心 细心 ,0,1
6941,2501098,8,北京路 店 朋友 带路 吃 真的 上瘾 喇 优惠价 特意 再团 张 同事 味道 不错 斤 烤鱼 加 木桶 饭 青菜 够吃 同事 赞不绝口 介绍 吃 ,1,1
6942,73798971,6,一般般 服务态度 不错 希望 食物 好吃 ,1,1
6943,5638032,7,服务 口味 不错 晚 点 吃 吃 特色菜 ,1,1
6944,633706,8,食量 味道 不错 老板 热情 太 满意 ,1,1
6945,2501098,8,还会 吃 鱼 烤 香 很鲜 自由 搭配 配菜 味道 不错 ,1,1
6947,5638032,8,环境 不错 服务 上菜 特别 喜欢 他家 小米 糕 好吃 ,1,1
6949,73798971,8,吃 好多好多 次 便宜 好吃 试一下 ,1,1
6950,4739416,8,味道 酸甜 适中 服务态度 食品 鲜明 ,1,1
6952,179658375,4,椰子 鸡 份量 少 口味 性价比 不高 ,0,1
6953,73798971,8,加大 牛排 份量 足 蘑菇 汁 不错 ,1,1
6955,5527472,8,好吃 汁 美味 点 中辣 辣得 爽 ,1,1
6957,107382571,8,味道 环境 不错 价格 实惠 ,1,1
6960,633706,6,环境 当天 预约 当天 牛排 鸡排 不错 蘑菇 汤 味道 习惯 吃 蔬菜 沙拉 味道 柠乐 真心 不错     柠乐 真心 不错   柠乐 真心 不错   柠乐 真心 不错   柠乐 真心 不错   柠乐 真心 不错 ,1,1
6961,73798971,7,不错 服务 出品 价钱 环境 ,1,1
6962,633706,8,朋友 说 不错 环境 音质 美食 美味 下次 光顾 ,1,1
6963,633706,8,灰常 满意 ,1,1
6964,73798971,8,挺     支持 吃   环境 朋友 恋人 ,1,1
6965,158754521,8,环境 特别 适合 情侣 约会 哈哈哈 推荐 ,1,1
6967,633706,8,服务 吃 感觉 两个 套餐 两个 吃 吃不完 三个 吃 极力推荐 ,1,1
6968,73798971,8,喜欢 ,1,1
6969,187419272,9,超级 棒 强烈推荐 位置 好找 旅游 广州 吃 第一家 店 风格 店家 超级 大方 超级 有趣 哈哈哈 推荐 招牌 车仔面 套餐 性价比 无敌 猪肠 好吃 ,1,1
6971,2501098,8,份量 两个 足够 城市 中心地段 价格 算 便宜 ,1,1
6973,2501098,8,味道 不错 分量 挺足 值得 品尝 ,1,1
6974,73798971,8,价钱 位置 好找 吃饱 环境 不错 ,1,1
6976,633706,8,不用 说 赞 ,1,1
6977,95652015,8,不错 吸猫 地方 ,1,1
6979,633706,8,第二次 老板 友善 ,1,1
6981,73798971,7,不错   同学 推荐   点赞 o ,1,1
6982,633706,5,帮 姐姐 买 机会 尝尝 ,0,1
6990,4739416,8,选 海底 世界 料 服务 ,1,1
6992,633706,6,牛排 不错 切不开 T 骨 扒 筋 沙朗 不错 ,1,1
6995,5527472,9,周日 同学 北京路 分店 吃 幸运 位置 不用 服务员 态度 动作 麻利 以往 现场 调配 酱料 煮 分量 足 材料 新鲜 吃 很饱 满意 特别 餐前 花生 喜欢 ,1,1
6996,73798971,8,第二次 吃 性价比 不错 店 套餐 里 东西 稍微 少 点 餐包 蛋 沙拉 牛排 味道 分量 ,1,1
6997,2501098,8,味道 服务周到 细心 ,1,1
6999,2501098,7,朋友 两个 吃 香辣 拷鱼 吃 很饱 吃 完 吃 有点咸 感觉 配菜 比鱼 好吃 ,1,1
7000,4739416,8,位置 好找 店 出口 新鲜 赞 ,1,1
7001,164166476,8,服务员 小姐姐 美 选择 环境 好好 ,1,1
7002,4739416,8,好吃 天河 低 价格 吃 棒 寿司 真的 不错 服务 噢 老板 热情 寿司 好吃 ,1,1
7005,73798971,8,出品 行 地理位置 性价比 高 ,1,1
7006,73798971,8,不错 味道 价格 实惠 ,1,1
7009,4739416,8,味道 不错 不用 等位 分量 ,1,1
7010,91361393,7,分量 很足 特别 肉 吃 很饱 炒年糕 很辣 ,1,1
7011,73798971,8,朋友 吃 东西 好吃 上菜 速度 ,1,1
7012,73798971,8,强烈推荐 分量 很足 环境 吃 地方 ,1,1
7014,74582725,8,榴莲 少女 吃 榴莲 乐疯 ,1,1
7016,5527472,8,服务 周到 上菜 很快 吃 ,1,1
7017,86045,8,一共 四个 人去 点 五个 菜 朋友 去过 朋友 不错 整体 不错 点 冬阴功 吃 不惯 朋友 说 服务员 态度 挺 ,1,1
7018,73798971,8,小伙伴   口味 好吃   下次 还会   价格 不算 贵 ,1,1
7019,74582725,8,一如既往 好吃 ,1,1
7020,73798971,8,团购 还好   团购 牛排 好吃   合算 ,1,1
7021,633706,8,不错   朋友 喜欢 吃   挑   ,1,1
7022,2501098,5,口味 烤鱼 做 烤出 口感 ,0,1
7023,5638032,6,行 不错 人太多 味道 ,1,1
7025,73798971,6,牛排 不错 小吃 好吃 服务 不太好 ,1,1
7026,73798971,8,感觉 不错 环境 不错 今晚 ,1,1
7028,159146980,8,老板 出门 吃 两碗 冰激淋 ,1,1
7029,2501098,8,分量 很足 味道 还好 团购 划算 团购 贵 ,1,1
7031,92159107,6,印象 深刻 风味 特别 下次 烤 榴莲 好吃 ,1,1
7033,5527472,8,位置 不错 挺好吃 麻辣味 不错 ,1,1
7035,73798971,8,好吃 基层 几把 子 ,1,1
7036,5638032,8,排队 上菜 速度 行 口味 不错 ,1,1
7037,2501098,6,行 份 足 菜 感觉 原材料 冰箱 里 冻 久 ,1,1
7039,119357852,7,出品 不错 30 元 优惠券 赠送 ,1,1
7041,633706,5,东西 湖 个个 都市 说话算话 ,0,1
7043,74582725,6,环境 不错 味道 量 太少 点 ,1,1
7045,633706,8,团购 吃 比较满意 口味 不错 环境 ,1,1
7046,179507699,8,环境 不错 服务周到 空间 很大 座位 本来 担心 排队 菜品 很棒   冬阴功 汤   海鲜 菠萝 炒饭 ,1,1
7047,633706,4,想 好吃 便宜 服务 别去了 便宜 便宜 服务 出品 不行 ,0,1
7048,633706,8,这家 店 位于 繁华 北京路 天河城 百货 楼上 好找 楼上 吃饭 地方 不用 等位 找到 位子 坐下 服务生 上菜 挺快 综合 地理位置 口味 环境 这家 餐厅 划算 牛排 很大 一块 吃爽 小面包 好吃 椰蓉 酱 南瓜饼 吃 好吃 六个 点点 腻 试试 ,1,1
7049,5527472,5,一般般 想象 中 好吃 ,0,1
7051,73798971,8,东西 好吃 便宜 新鲜 赞 每次 都料 光顾 味道 保存 环境 装修 风格 地中海 服务员 态度 真心 太暴 门口 排队 东西 便宜 好吃 人才 挺 满意 下次 还会 关顾 赞赞赞 ,1,1
7052,73798971,8,味道 什果 沙律 挺 新鲜 下次 希望 水准 增添 更多 新菜式 ,1,1
7054,2501098,8,分量 足 上菜 速度慢 烤鱼 不错 ,1,1
7056,95652015,6,不错 猫咪 可爱 熊 孩子 太多 事前 教育 熊 孩子 ,1,1
7057,4739416,8,每次 点 女生 食 饱饱 份量 足 ,1,1
7058,73798971,5,味道   优惠   值得 一吃 ,0,1
7059,73798971,8,团购 双人 餐 满意 价格 82 食物 性价比 高 ,1,1
7060,5638032,5,总体 不错 老醋 凤爪 太 难吃 下次 点 ,0,1
7061,73798971,8,环境 挺 套餐 优惠 味道 挺不错 ,1,1
7062,633706,6,第二次 选 座位 老板娘 嘀嘀咕咕 听 舒服 鸡排 上次 好吃 总体 服务态度 上次 口味 老公 挺 喜欢 下次 还会 希望 改进 ,1,1
7063,2501098,8,味道 喜欢 吃 他家 菜 ,1,1
7064,633706,8,好吃 服务 环境 不错 适合 聚餐 ,1,1
7065,633706,6,口味 份量 足 机会 ,1,1
7066,2501098,8,菜品 口味 环境 服务态度 ,1,1
7067,73798971,7,不错 ,1,1
7068,5527472,8,味道 不错 吃 吃 环境 还好 ,1,1
7069,633706,8,同学 齐行 行 选择 困难 症 终于 记得 出场 今日 咩 阵间 坐 上菜 速度 字 D 排 热辣辣 充满 热力 ,1,1
7070,5527472,6,不错 感觉 够味 没什么 酱紫 收费 不爽 挺 高 环境 不错 够 大够 亮堂 服务 周到 ,1,1
7071,73798971,8,第一次 餐厅 环境 不错 份量 十足 下次 ,1,1
7072,73798971,8,实惠 好吃 ,1,1
7073,158754521,8,味道 微辣 吃 很爽   下次 还会 ,1,1
7074,73798971,4,牛排 难吃 好多 分量 ,0,1
7075,633706,7,第二次 吃 熟悉 味道 不错 ,1,1
7077,86045,6,行 椰子 汤 每次 ,1,1
7078,633706,9,忘 第几次 竹风 每次 生意 特别 老板 服务员 重点 特别 好吃 喜欢 就家 吃 东西 环境 家 希望 团购 升 价钱 老板 ,1,1
7080,158754521,8,挺 团购 小吃 单点 会贵 地址 位于 步行街 东方 汇 四楼 手 扶梯 左手边 环境 不错 有时候 太忙 味道 两个 吃货 刚刚 ,1,1
7081,633706,5,还好 ,0,1
7082,73798971,6,口味 行 上菜 速度 很快 环境 小辣条 太 合口味 腥腥 味道 总体 满意 ,1,1
7083,2501098,7,烤鱼 好吃   想点 清江 鱼   太大条   脘 鱼 不错 ,1,1
7084,633706,7,位置 好找 环境 不错 服务 上餐 很快 味道 适中 老婆 说 淡 份量 很足 两个 吃 物超所值 下次 还会来 ,1,1
7085,5527472,8,朋友 推荐 香味 浓郁 味道 光临 ,1,1
7088,107377267,8,男朋友 上周 点 虾 煲 太 好吃 服务员 哥哥 好开心 份量 特别 足够 下次 还会来 太 好吃 下次 吃 鸡翅 吃 一遍 吃货 本质 ,1,1
7091,2501098,8,挺好吃 上菜 还会 ,1,1
7092,633706,8,,1,1
7093,86045,8,不错 不错 ,1,1
7101,2501098,8,服务 奉 主管 服务 贴心 菜品 很正 下次 光临 ,1,1
7104,74582725,8,榴莲 鸡煲 不错 汤 浓郁 还会 光顾 服务员 小姐姐 挺不错 ,1,1
7105,164166476,8,味道 好吃 份量 充足 服务 周到 环境 坐 舒服 ,1,1
7106,73798971,8,不高 性价比 高 套餐 优惠 ,1,1
7107,73798971,9,噶 咖喱 虾 味道 不错 正宗 仲 正 牛扒 甘 好吃 ,1,1
7111,73798971,8,味道 赞 环境 值得 推荐 ,1,1
7112,5638032,8,味道 正宗 卫生 价格 公正 比主助餐 好多 ,1,1
7113,164409108,6,服务 环境 不错 吃不饱 ,1,1
7114,2501098,7,  理想 中   口感 适合 北方 ,1,1
7115,158754521,7,口味 不错 想象 地辣 ,1,1
7116,73798971,7,团 购价 很值 朋友 吃饭 聊天 聚餐 地方 环境 ,1,1
7119,179453956,5,味道 分量 人均 100 ,0,1
7121,73798971,7,分量 足 吃得饱 口味 不错 不太好 套餐 里 蔬菜 水果 夹带 丢 丢 完美 ,1,1
7122,158754521,8,服务态度   上菜   东西 好吃 ,1,1
7123,2501098,8,真的 划算 味道 服务 不错 ,1,1
7125,2501098,8,味道 不错   吃   哈哈哈   挺   下次 ,1,1
7127,5638032,8,光明 广场 楼团 先前 貌似 菜品 量 少 一点 特别 雪菜 黄鱼 挺 喜欢 味道 还好 客人 几次 答应 福寿 面 价钱 值 味道 提升 空间 总体 算 满意 习惯 好评 ,1,1
7128,5527472,5,环境 还好 口味 挺贵 ,0,1
7131,633706,9,老板 老板娘 接待 一位 顾客 真 不多见 亲切 友善 第一次 光顾 上菜 速度 真的 很快 牛排 鸡排 很大 块 分量 很足 美团 偷工减料 赞 汤 喝 习惯 必胜客 汤 类似 沙拉 分量 点点 少 不错 性价比 高 下次 还会 光顾 ,1,1
7132,179658375,8,味道 不错 挺 ,1,1
7133,73798971,8,环境 新开 上莱快 支持 ,1,1
7134,86045,6,味道 一般般 量 精致 服务 人员 不太理 ,1,1
7136,633706,6,吃 挺不错   服务员 问 团购 号码   搞 尴尬 环境 不错   挺 实惠 ,1,1
7137,163178422,8,光顾 实惠 好吃 ,1,1
7139,5527472,6,整体 环境 热 点 位置 舒服 ,1,1
7140,633706,6,圣诞节 繁华 北京路 食到 扒 价钱 便宜 不错 扒 食 不敢恭维 ,1,1
7143,633706,7,味道 不错 环境 ,1,1
7144,5638032,8,公司 对面 快成 饭堂 团购 划算 ,1,1
7145,633706,8,天河城 百货 楼 韩国 自助餐 对面 套餐 吃 很饱 菜单 店 菜品 价格 服务态度 吃不完 打包 鸡 扒 一般般 炸鸡 排 更好 环境 不错 没什么 不用 预定 ,1,1
7146,2501098,5,朋友 喜欢 吃 一般般 ,0,1
7148,73798971,8,好吃 环境 份量 很足 ,1,1
7149,67446384,8,位置 好找 北京路 店里 做 炸鸡 两块 毛钱 质量 蛮高 冰淇淋 浓浓的 酸奶 味道 凉凉的 甜甜的 适合 夏天 吃 饭点 店里 环境 喜欢 朋友 试试 ,1,1
7150,633706,8,挺好吃 喜欢 ,1,1
7152,2501098,8,味道 不错 吃 不厌 ,1,1
7155,73798971,8,挺 实惠 环境 机会 还会来 ,1,1
7156,163178422,8,去过 次 自助 水果 充足 孩子 喜欢 牛肉 新鲜 ,1,1
7160,633706,6,牛排 量 吃 还行 吃 ,1,1
7163,633706,5,环境 老板 服务 挺 菜 ,0,1
7164,107377267,8,食物 味道 不错 环境 舒适 约会 聚餐 最佳 选择 呦 ,1,1
7165,92159107,5,网红店   特色   菜品 说 特别 好吃 ,0,1
7166,5527472,8,不错 味道 好多 下次 ,1,1
7167,164166476,8,肉蟹 煲 不错 服务 下次 还会 ,1,1
7169,73798971,8,东西 罗宋汤 辣味 ,1,1
7170,633706,8,环境 不错 服务周到 口味 超赞 价格 贵 值得 推荐 ,1,1
7174,633706,8,广州 旅游   找 好久 选择 吃   服务 热情   挺 喜欢 ,1,1
7175,73798971,6,牛扒 想像中 好吃 甜不辣 不错 ,1,1
7177,2501098,8,朋友 特别 喜欢 吃 辣 味道 地方 好吃 份量 挺 ,1,1
7178,2501098,7,辣到 鼻炎 好吃 ,1,1
7183,5638032,8,下次 还会 女朋友 吃 挺 开心 ,1,1
7184,158754521,8,不错 蟹肉 软 鸡爪 好吃 ,1,1
7187,2501098,8,团购 实惠 代金券 ,1,1
7189,73798971,8,环境 价格便宜 分量 下次 还会 ,1,1
7191,107377267,8,点 虾 煲 味道 好吃 海边 长大 虾 新鲜 强烈推荐 ,1,1
7194,107377267,7,口味 蟹味足 好吃 ,1,1
7195,633706,8,扒 分量 很足 吃 很饱 服务态度 朋友 ,1,1
7196,2501098,8,不用 排队 环境 不错 上菜 挺快 味道 不错 两个 消费 高 ,1,1
7197,4739416,8,食材 算 新鲜 品种 不算 推荐 ,1,1
7198,633706,8,总体 味道 行 环境 ,1,1
7199,107377267,6,感觉 行   行   还行   光线 太 幽暗   看不清 卖相 ,1,1
7200,172239782,6,抢购 69 元三人餐 好吃 环境 差 点 菜品 不错 ,1,1
7201,633706,5,还好 ,0,1
7202,73798971,7,喜欢 他家 牛排 ,1,1
7203,73798971,8,气氛 味道 三五个 朋友 牛排 七分 熟 玉米汤 好喝 拍照 ,1,1
7206,90908955,8,撸 猫 开心 ,1,1
7208,2501098,8,味道 不错 噢 等位 等位 送 饮料 服务态度 地理位置 北京路 店 好找 还会 ,1,1
7209,107377267,9,口味 服务周到 态度 服务 强烈推荐 ,1,1
7210,633706,8,不错 分量 挺 环境 不错 ,1,1
7211,5527472,8,挺不错 女朋友 两个 吃 饱饱 挺 美味 ,1,1
7213,5527472,8,第二次 吃   不错   吃 很饱 ,1,1
7214,2501098,8,不错 不错 笑 口味 不错 下次 还会 ,1,1
7216,73798971,8,第一次 吃 家 牛排 团购 实惠 分量 很足 服务态度 位置 找 ,1,1
7218,5527472,8,好吃 优惠 便宜 11111111 ,1,1
7219,5638032,4,不太 好吃 光明 广场 这间 九毛 点 一碗 面 只见 汤 见面 排骨 骨 没肉 出品 有待 提高 ,0,1
