,id,star,comment,sentiment,snlp_result
3585,73798971,8,地方 好找 环境 特别 大爱 他家 店 东西 好吃 服务态度 ,1,1
3589,86045,10,芝士 火锅 爱 吃 久 吃 吃 特别 鱼线 必点 ,1,1
3590,633706,10,不错 朋友 吃 口感 不错 分量 很足 两个 吃 撑 两份 排 分量 足 味道 上菜 速度 很快 美中不足 蔬菜 沙拉 新鲜 换成 水果 沙拉 更好 夏天 冰 拿上来 口感 更好 ,1,1
3591,2501098,8,人太多 味道 还好 送 小吃 挺 ,1,1
3595,73798971,10,环境 不错 服务 东西 好吃 ,1,1
3596,74582725,10,要试 鸡 扒 芒果 糯米饭 d 芒果 超大 份 仲有 披萨 ,1,1
3597,160789530,10,味道 不错 吞拿鱼 沙拉 好吃 ,1,1
3598,73798971,9,建议 服务员 端 牛排 牛排 中 油 飞溅 烫伤 顾客 味道   环境   性价比 高 值得 推荐 ,1,1
3599,5638032,10,爱人 喜欢 吃 这家 面馆 挺 干净 服务 团购 菜 全 满分 ,1,1
3600,5638032,10,不错 赞 下次 吃 服务态度 东西 好吃 ,1,1
3601,73798971,8,吃 不错 划算 东西 ,1,1
3602,107377267,10,环境 不错 ,1,1
3603,633706,9,分量 很足 味道 牛肉 很嫩 ,1,1
3604,73798971,9,本来 想着 优惠 打折 团购 就团 环境 挺不错 不算 不用 排队 上菜 时间 菲力 牛排肉 很嫩 轻轻 切下 好吃 日式 炸豆腐 挺好吃 柠檬茶 好喝 下次 ,1,1
3606,74582725,10,榴莲 主题 餐厅 表弟 表妹 几个 喜欢 ,1,1
3610,86045,10,198 四人餐 四个 美女 吃 足够 足够 分量 足 环境 服务员 态度 美中不足 汤底 太 咸 总体 不错 下次 ,1,1
3612,73798971,10,环境 不错 服务态度 热情 满意 满意 满意 太 满意 木瓜 沙冰 滑 好喝 ,1,1
3613,5527472,8,挺 足量 腻 位置 环境 不错 ,1,1
3614,164661961,8,人餐 可够 三人 吃 吃 刚刚 味道 不错 ,1,1
3616,5527472,10,很棒 环境 不错 每次 黄记煌 满意 价格 略贵 ,1,1
3617,5638032,10,不错 饭量 不错 ,1,1
3618,73798971,8,那间 关闭 连忙 电话 预约 环境 不错 次 上菜 小妹 挺 漂亮 美女 逛街 吃 成熟 西冷 生 希望 下次 ,1,1
3619,86045,10,三杯 鸡 不错 牛肉 藕 饼 好吃 东 阴功 海鲜 锅 一般般 甜品 不错 下次 希望 优惠 一点 三个 吃 190 ,1,1
3621,5527472,8,不错 好久 吃 ,1,1
3623,633706,10,吃 N 次 便宜 好吃 环境 不错 ,1,1
3624,2501098,10,行 ,1,1
3625,633706,6,第一次 吃 价格 分量 少 特别 饭量 一碗 希望 改进 ,1,1
3626,633706,10,不错 感觉 人多 位子 挤 对得起 价格 便宜 下次 回去 ,1,1
3627,73798971,8,那天 晚 自助 少 吃 饱饱 自助 东西 便宜 牛排 不错 环境 面店 找 ,1,1
3629,5527472,6,两个 吃不完 撑住 位置 上菜 ,1,1
3630,156593954,10,,1,1
3632,633706,8,不错 上菜 速度 ,1,1
3635,117225790,6,很贵 太 好吃 翠华 餐厅 好吃 想 吃 港式 餐厅 推荐 试试 翠华 好吃 港 菜 ,1,1
3636,5527472,10,不错 味道 环境 不错 ,1,1
3638,2501098,8,味道 不错 吃 蒜 香 豆瓣 味 蒜 香 豆瓣 咸 总体 很赞 ,1,1
3640,73798971,9,环境 不错 服务态度 好吃 ,1,1
3641,2501098,9,点 很辣 三个 吃 150 打包 回去 一部分 不错 ,1,1
3642,633706,9,上菜 服务 东西 不错 挺 值得 ,1,1
3643,2501098,9,还行 ,1,1
3644,5527472,10,不错 ,1,1
3645,164166476,3,点 肉 蟹 煲 螃蟹 鸡爪 口味 啃 鸡爪 啃到 心累 地方 吃 肉 蟹 煲 底料 这家 土豆 冬瓜 餐桌 亮点 ,0,1
3649,117225790,8,蛋挞 不错 下次 还来 ,1,1
3650,169458693,8,料好 足 好大 一盘 服务 特别 ,1,1
3651,5638032,8,挺 味道 不错 材料 新鲜 好吃 ,1,1
3652,73798971,6,味道 一般般 性价比 高 环境 ,1,1
3654,633706,10,味道 好极了 想 吃   服务 一级 棒 贴心 ,1,1
3656,179658375,8,不错 ,1,1
3657,633706,9,扒 不错 沙拉 炸鸡 条 好吃 ,1,1
3658,5638032,6,环境 光明 广场 那家店 感觉 环境 不错 不算 特别 嘈杂 总体 挺 服务 人手不足 下单 服务员 多问 显得 不耐烦 口味 杂酱面 分量 不算 杂酱 料 做 不错 很显 功夫 面条 口感 大不如前 真的 差 酱 萝卜 皮 微辣 爽脆 味道 雪菜 黑 豆腐 分量 足 味道 清淡 黑 豆腐 好吃 口感 番茄 鸡蛋 面 清淡 一款 面 面条 好吃 真的 差 面条 口感 不好 ,1,1
3661,2501098,10,环境 味道 值得 等位 ,1,1
3663,4739416,10,永远都是 星 好评   质感   物美价廉 ,1,1
3666,73798971,8,超级 划算   超级 划算   超级 划算   超级 满意   事 说 三遍   好吃   每次 吃不完 ,1,1
3668,633706,10,真心 实惠 值得 一试 ,1,1
3669,2501098,10,鱼 新鲜 味道 不错 环境 不错 服务态度 不错 北京路 店 位置 店 ,1,1
3672,73798971,10,好吃 汤好 美味 值得 推荐 牛肉 新鲜 ,1,1
3673,5638032,8,味道 还好 不用 等位 久 服务态度 ,1,1
3674,107377267,10,不错 第一次 吃 很赞 希望 下次 吃 ,1,1
3675,73798971,10,美团 吃 东西 优惠 吃货 不二 自选 店家 服务态度 挺 美团 怠慢 东西 好吃 没事 吃 美团 超 验证 不错 环境 装修 特别 适合 情侣 整洁 东西 好吃 祝 生意兴隆 ,1,1
3676,5527472,8,不错 贵 服务态度 挺 口味 挺 多种 ,1,1
3678,633706,10,整体 感觉 不错 味道 不错 环境 不错 ,1,1
3679,633706,10,满意 ,1,1
3681,633706,8,位置 好找 环境优美 服务 ,1,1
3682,633706,6,好吃 服务态度 上菜 速度 ,1,1
3683,73798971,8,味道 不错 服务 太度 值得 推荐 ,1,1
3685,5638032,3,焖 面 汤面 ,0,1
3686,633706,10,服务 东西 吃 撑 牛排 很大 块 总体 ,1,1
3688,86045,8,挺 众多 东西 虐贵 ,1,1
3693,158754521,10,份量 超多 三四个 吃饱 味道 不错 下次 试一下 蟹 ,1,1
3694,5527472,8,不错 喔 味道 挺 价钱 贵 环境 不错 ,1,1
3695,73798971,9,味道 挺不错 上菜 速度 很快 好评 ,1,1
3696,73798971,8,味道 不错 价格 实惠 环境 优雅 太 嘈杂 ,1,1
3697,67446384,10,忘记 第几次 反正 超值 美团用 团购 10 块 不到 店里 服务态度 挺不错 环境 挺 团购 吉祥 三宝 点 杯 柚子 百香果 味道 店家 每次 送 小吃 酸 萝卜 挺好吃 总体 体验 很棒 ,1,1
3698,5638032,7,还行 喜欢 万达 ,1,1
3699,2501098,7,吃 团 券 挺 便宜 服务态度 不错 地方 拥挤 高峰 时间 周末 等位 喜欢 吃 辣 香辣 麻辣味 道 感觉 有时候 厨师 盐放少 味道 吃 回来 拉 四次 复 肚子 干净 ,1,1
3700,5527472,10,口味 不错 服务 不错 环境 不错 位置 交通 ,1,1
3703,95652015,10,评论 中 猫 想 我人 楼下 半个 小时 猫猫 玩 猫猫 挺累 特别 熊 孩子 妈妈 教育 硬是 要死 拉 猫 猫 吓倒 猫 合 还会 主动 找 玩 店主 休息 多人 围着 挺 累 店 出品 行 团购 泡泡 冰 花茶 款 店主 说 款式 随意 希望 蛋糕 ,1,1
3706,73798971,10,性价比 高 好吃 朋友 吃 几次 说 好吃 尝尝 真的 好吃 ,1,1
3709,5527472,5,味道 不错 服务 挺 环境 值得 推荐 ,0,1
3710,5638032,10,家人 毛 常客 每家店 服务 星级饭店 水准 九毛 企业 文化 做 聆听 顾客 意见 推荐 九毛 菜式 每次 必点 炝 炒 小白菜 平遥 牛肉 驴肉 羊杂 割 白菜 猪肉 饺子 非常感谢 企业 饭店 服务 消费者 大众 还会 支持 九毛 支持 山西 风味 ,1,1
3711,2501098,8,服务 不怎么样 不错 ,1,1
3713,2501098,10,第二次 感觉 服务 环境 挺不错 ,1,1
3716,4739416,10,点 海底 世界 味道 不错 份量 略少 肯定 吃不饱 ,1,1
3717,73798971,10,系 北京路 环境 好好 够 舒服 ,1,1
3719,4739416,10,路过 听到 有人 走出 东西 好吃 心 心念 找个 时间 试试 隔壁 食堂 东西 难免 本来 三文鱼 腩 换成 三文鱼 刺身 自觉 挺 新鲜 切片 厚 团 海底 世界 盖饭 分量 挺 好吃 鹅 肝 寿司 鲜虾 寿司 点赞 鹅 肝 入口 化 鲜虾 真的 新鲜 啊啊啊 搞 自助 适合 吃 吃 吃 一份 沙律 爱 吃 蟹子 味道 不错 是因为 沙律 酱 拌 两个 人去 吃 一份 团购 人均 50 回购 ,1,1
3721,2501098,10,行 ,1,1
3722,158754521,9,沙滩 桌子 环境 幽暗 菜 很快 ,1,1
3723,5527472,10,n 次 吃 团购 划算 好吃 环境 服务员 态度 友善 32 个赞 支持 一如既往 支持 ,1,1
3724,620278,10,好吃 不错 ,1,1
3725,633706,8,喜欢 牛排 鸡 扒   配菜 好吃 ,1,1
3726,164409108,10,探店 今半 食堂 第一次 试 火锅 感觉 挺 奇怪 过瘾 ,1,1
3729,73798971,10,划算 口感 环境 服务 ,1,1
3731,633706,6,每次 吃   不错   圣诞 忙   菜   水没上   饮料 没上 ,1,1
3732,73798971,10,不错 好吃     环境 不错 人多 ,1,1
3733,73798971,8,第一次 吃 挺不错 ,1,1
3735,4739416,8,去过 每次 不错 尝试 新 包罗万有 盖饭 感觉 好吃 ,1,1
3738,5527472,6,验证 很快 上菜 慢 茶水 ,1,1
3740,5527472,6,行 冬天 吃 暖暖的 环境 算 OK ,1,1
3742,91361393,10,分量 足 地方 好找 推荐 适合 聚餐 ,1,1
3743,73798971,9,换 地方 光明 广场 店内 环境 好大 服务 不错 牛扒 味道 团购 划算 吃 还会 ,1,1
3745,158754521,10,菜品 特别 好好 好好 哈哈哈 特别 喜欢 味道 不错 ,1,1
3747,73798971,4,汤 难 喝 还好 ,0,1
3748,633706,10,东西 不错 服务 挺 不用 排队 ,1,1
3749,633706,10,挺 ,1,1
3750,2501098,10,团购 去过 几次 味道 行 两个 吃 很饱 米饭 一大 瓶 饮料 很撑 味道 环境 服务 不错 ,1,1
3751,5638032,9,分量 很大 ,1,1
3753,2501098,10,味道 服务 值得 ,1,1
3754,74582725,5,榴莲 鸡 味道 榴莲 鸡汤 柠檬水 ,0,1
3755,73798971,10,周日 女儿 放学 北京路 女儿 建议 光明 广场 牛 焰火 牛排 餐厅 就餐 双人 餐 性价比 高 两份 牛排 意粉 份 粟米 汤 份 罗宋汤 两杯 饮品 碟 绿茶 饼 份 水果 沙拉 餐厅 环境 宽阔 舒适 服务员 态度 热情 团购 怠慢 ,1,1
3756,633706,10,服务周到 态度 东西 好吃 肉 大片 ,1,1
3757,5527472,8,挺不错 味道 不用 排队 ,1,1
3759,633706,6,口味 ,1,1
3760,2501098,10,超级 喜欢 每次 北京路 选择 它家   清江 鱼香 辣味 ,1,1
3761,74582725,10,马来西亚 风味 榴莲 口味 一级 棒 行 ,1,1
3762,4739416,10,出品 价格 实惠 北京路 闲逛 回来 做饭 吃 盖饭 ,1,1
3763,73798971,8,团购 牛排 人餐 光明 广场 三楼 那店 环境 整洁 舒适 ,1,1
3764,73798971,8,第一次 吃     美团 店付 区别 坐下 位置 柠檬水 先 送过来 ,1,1
3766,90908955,9,真的 太 可爱   猫爪 爆炸 头雪泡 杯 ,1,1
3770,4739416,10,还好 还好 还好 吃 几次 吃 吃 还好 还好 ,1,1
3774,633706,10,吃 很饱 环境 ,1,1
3775,633706,10,每次 不错 ,1,1
3776,5527472,10,味道 不错   墨鱼 仔 新鲜   还好 ,1,1
3777,633706,10,服务态度 热情 挺不错 口味 ,1,1
3778,107382571,6,味道 不错   服务员 餐厅 打情骂俏   ,1,1
3779,159146980,8,总体 不错 喜欢 吃 肉 朋友 推荐 ,1,1
3783,5527472,5,东西 出品 不错 材料 挺 新鲜 服务 ,0,1
3784,107377267,10,想来 吃 久 男朋友 吃 仔排 煲 好吃 ,1,1
3786,158754521,10,浪漫 餐厅 环境 味道 很赞 值得 ,1,1
3788,2501098,10,好吃 分量 特别 足 两个 吃 好吃 ,1,1
3789,73798971,9,位置 好找 味道 不错 环境 氛围 适合 约会 ,1,1
3791,633706,4,牛扒 套餐 不错 水果 拼盘 太 少 水果 ,0,1
3792,2501098,9,吃 挺 三个 一条 烤鱼 包菜 吃 挺 环境 不错 不贵 一百多 挺 划算 服务 变差 上菜 慢 ,1,1
3794,74582725,10,鳗鱼 饭 好吃 分量 足 米饭 家 好吃 八爪 鱼 摩托罗拉 不错 点 一般般 位置 算 好找 地方 太小 环境 真的 mini 形容 还好 不用 排队 服务 人员 两个 人用 优惠券 一百多 猫 山王 榴莲   榴莲 芝士 蛋糕   芝士 蛋糕 ,1,1
3796,5527472,8,味道 不错 ,1,1
3797,633706,10,不错 下次 还会   希望 下次 多一点 团购 ,1,1
3798,2501098,9,口味 不错 好吃 嫩嫩的 ,1,1
3799,2501098,9,愉快 用餐 服务员 特别 棒 上菜 速度 蛮快 感谢 老板 送 西瓜 强烈推荐 ,1,1
3800,2501098,10,味道 不错 逛 北京路 时侯 光顾 餐厅 ,1,1
3802,109403441,9,广州 第一餐 不错 好吃 ,1,1
3803,95652015,10,那次 猫 楼 换鞋 洗手 消毒 顾客 猫 建议 挑人少 时间 一大群 围着 几只 猫会 恐怖 氛围 小时 吃饭 抽出来 套餐 猫 粮 全场 猫 吸引 帅 略贵     养猫 场 味道 满天飞 猫 毛 老板 花 心思 打理 赞 ,1,1
3804,2501098,10,味道 辣香 环境 不错 下次 有团 还团 ,1,1
3806,2501098,8,划算 双人 餐 够 三个 吃 ,1,1
3807,119357852,10,肉 干 太老 奶茶 不香 茶味 奶味 ,1,1
3809,5638032,9,最爱九毛 金瓜 小米粥 每次 必点 ,1,1
3810,5527472,9,这家 店 环境 服务员 态度 不错 菜品 ,1,1
3811,5527472,3,菜品 价格 偏贵 吃饭 秘制 汁 不错 腻 ,0,1
3814,5527472,10,不错 下次 还会 哈哈哈 ,1,1
3815,73798971,10,推荐 推荐 便宜 味正 我点 环境 女票 成手 感觉 女票 熟 一点 不错 ,1,1
3816,164166476,10,吃 几次 味道 一如既往 哥哥 小姐姐 服务 上菜 大大的 赞 ,1,1
3817,73798971,6,口味 行 服务 热情 美团订 套餐 怠慢 ,1,1
3818,633706,6,上菜 超快 免费 WIFE 休闲 好去处 ,1,1
3819,5527472,10,味道 很棒 喜欢 焖 锅 环境 服务 赞 ,1,1
3821,633706,8,牛排 很大 份 食物 分量 足 赞 ,1,1
3822,86045,6,坐得 唔 舒服 台细 逼 空气 差 吃物 分量 价钱 不算 贵 ,1,1
3823,158754521,10,好吃   说 味道 很棒 ,1,1
3824,633706,10,不错 好多年 店 2013 年 ,1,1
3828,5527472,10,味道 价格 实在 贵 对得起 价钱 ,1,1
3829,5527472,8,三黄鸡 超级 好吃 每次 赞 ,1,1
3830,73798971,9,北京路 店 位置 很早 找 地铁站 D 出口 走 500 米左右 菜品 推荐 椰奶 沙冰 浓浓的 奶香 好喝 牛排 加 10 元 加大 分量 挺足 栗 米汤 不错 玉米 甜甜的 汤 爽口 划算 满意 体验 ,1,1
3831,633706,7,上菜 划算 牛排 分量 ,1,1
3832,73798971,10,服务 味道 不错 环境 挺 ,1,1
3833,2501098,9,烤鱼 不错 入味 麻辣 香锅 够味 上菜 很快 服务 挺 ,1,1
3834,107377267,9,第一次 女朋友 环境 蓝色 海洋 主题 女朋友 说 喜欢 开心 味道 挺不错 适合 约会 地方 值得 推荐   凉拌 土豆丝   马家 地瓜 丸   鸡翅 煲   明虾 煲 ,1,1
3835,107377267,10,挺 光顾 味道 ,1,1
3837,5527472,9,不错     味道 还行 ,1,1
3839,73798971,5,环境 还好 服务 不错 牛扒 肉太老 ,0,1
3840,5527472,10,棒棒 棒棒 棒棒 棒 男女 宝宝 保暖   好赞 ,1,1
3841,179658375,10,中午 吃 不错 不用 排队 干净 卫生 吃 两次 价格 新鲜 服务态度 不错 哥哥 小姐姐 礼貌 和善 友好 这家 新开 新 干净 感觉 不错 不错 ,1,1
3842,633706,10,第二次 团购 沙拉 不怎么样 还好 物美价廉 ,1,1
3843,4739416,10,吃品 新鲜 好味 加饭 不错 ,1,1
3844,107377267,10,小姐姐 服务 ,1,1
3846,73798971,8,第几次 吃 岗 顶店 第一次 北京路 环境 比岗 顶店 情调 女朋友 喜欢 吃 甜不辣 可惜 换成 薯条 不错 吃 甜不辣 可惜 牛排 一如既往 嫩 成熟 好吃 ,1,1
3847,633706,10,环境 不错   鸡 扒 好吃   还算 ,1,1
3848,2501098,6,总体 感觉 不错 口味 不错 服务态度 ,1,1
3849,633706,10,服务态度 真的 东西 口味 不错 地方 北京路 值得 ,1,1
3852,2501098,8,流 沙包 好吃 总体 价格 偏贵 ,1,1
3854,5638032,3,一般般 真 感觉 好吃 ,0,1
3855,633706,10,好吃 服务态度 东西 好吃 ,1,1
3856,73798971,9,环境 挺 服务态度 位置 好找 吃 开心 味道 ,1,1
3858,73798971,9,套餐 划算 味道 分量 足 ,1,1
3859,73798971,9,环境 不错 牛排 口感 味道 好好 关键 价位 划算 满意 ,1,1
3861,164409108,9,朋友 吃 好吃 寿喜 烧 ,1,1
3862,5638032,8,N 次 吃 毛 男友 好爱来 吃 味道 不错 鸡翅 香点 ,1,1
3865,2501098,10,不错 儿童 套餐 精致 ,1,1
3866,633706,8,鸡排 不错 台湾 沙朗 牛排 不错 香芋 丸子 不错 羊肉串 饮料 不行 份量 很足 吃 记得 拍照 环境 一般般 油烟味 浓 ,1,1
3867,633706,9,总体 不错 牛扒 好吃 一点 位置 找   北京路 天河城 百货 一点半 等位 几分钟 点单 慢 一点 店里 热闹 点 完单 菜 很快 总体 挺不错 ,1,1
3868,633706,8,吃 东西 味道 挺 分量 足 两个 吃 吃 撑 唯一 沙律 冰 ,1,1
3870,2501098,8,北京路 烤鱼 首推 辣尚瘾 口味 清江 鱼 鲜美 棒棒 哒 ,1,1
3871,5527472,10,喜欢 吃 黄记 环境 不错 ,1,1
3872,73798971,10,服务 东西 不错 ,1,1
3873,5527472,8,不错 来过 很多很多 次 味道 喜欢 量 足 ,1,1
3874,160789530,9,北京路 步行街 黄金地段 服务 热情 口味 久久 回味 值得 ,1,1
3875,2501098,8,菜品 不错   鱼 嫩 味道 很赞 ,1,1
3876,5527472,9,好吃 每次 团购 算 便宜 ,1,1
3878,5638032,8,菜 味道 一如既往 喜欢 家常菜 味道 棒棒 哒 关键 价钱 实惠 亲朋好友 聚餐 极好 去处 特别 老豆腐 味道 很棒 吃 完 一份 点 一份 果汁 味道 不错 价钱 实惠 第二份 半价 唯一 不好 处 空调 不太 制冷 吃 汗流浃背 好评 ,1,1
3880,633706,8,性价比 不错 光线 太 少 店里 好暗 ,1,1
3881,5638032,8,光明 广场 楼团 先前 貌似 菜品 量 少 一点 特别 雪菜 黄鱼 挺 喜欢 味道 还好 客人 几次 答应 福寿 面 价钱 值 味道 提升 空间 ,1,1
3882,633706,8,不错 地方 好找 性价比 高 环境 优雅 ,1,1
3883,73798971,9,吃饭 环境 真的 不错 哒 价钱 实惠 口味 一般般 ,1,1
3884,164166476,9,口味 ,1,1
3885,633706,10,深海 鳕鱼 不错 好吃 给力 ,1,1
3886,73798971,8,牛扒 质量 不太高 挺 实惠 ,1,1
3887,91361393,3,味道 一般般 分量 很足 马马虎虎 ,0,1
3888,73798971,9,美味 道 不错 女孩 套餐 加 块钱 换成 爱心 爬 餐 鸡排 很大 好吃 感觉 超 划算 那种 团购 店里 鸡排 39 块钱 套餐 感觉 不用 加 购物车 鸡 扒 套餐 办好 牛排 套餐 50 ,1,1
3889,633706,2,美团 瞬间 一脸 待见 茶水 无视   美团 茶水 茶 水位 加 套餐 里 ,0,1
3894,73798971,8,菜式 美味 出品 挺 口感 不错 划算 推荐 ,1,1
3895,73798971,8,性价比 高 ,1,1
3896,633706,10,牛排 很大 味道 送餐 服务员 态度 大爱 台湾 腔 招待 老板 赞 ,1,1
3901,2501098,9,服务员 满分 姓 廖 姐姐 ,1,1
3902,633706,9,一男一女 吃 套餐 吃 很饱 分量 很足 牛扒 酱汁 太咸 点 ,1,1
3903,633706,8,味道 不错 分量 挺足 200 挺值 ,1,1
3905,90908955,9,人头 消费 套餐 猫 粮 店里 零售 猫 粮好 可惜 猫猫 可爱 店里 环境 不错 服务周到 ,1,1
3906,633706,9,还好 环境 不错 还会 ,1,1
3907,633706,9,好吃 过瘾 环境 服务周到 ,1,1
3908,4739416,0,真心 不错 甘样 价钱 份量 足 饭 加 ,0,1
3909,633706,9,不错 ,1,1
3910,73798971,9,不错 划算 菜 不错 ,1,1
3912,67446384,6,  总体   服务 不错   好吃 ,1,1
3913,158754521,3,试 想象 中 位置 难 找 ,0,1
3915,73798971,8,环境 牛排 肉质 特别 意面 软 硬 那种 烧焦 感觉 总体 不错 小吃 好吃 ,1,1
3916,633706,6,不好意思 迟来 评论 这家 餐厅 挺不错 东西 好吃 ,1,1
3917,73798971,9,环境优美 服务态度 牛排 美味 值得 推荐 ,1,1
3918,73798971,9,菜品 口味 不错 环境 建议 灯光 调光 味道 适合 年轻人 口味 服务态度 ,1,1
3919,73798971,8,味道 不错 光明 广场 楼上 位置 好找 ,1,1
3921,2501098,10,环境 行 逛累 吃 东西 好去处 鱼 还好 总体 不错 ,1,1
3923,5527472,6,菜味 服务 菜量 够 吃 ,1,1
3927,4739416,8,好吃 服务 刺身 值得 一吃 ,1,1
3929,107377267,8,贵州 吃 不惯 甜 挺 ,1,1
3930,5527472,8,喜欢 吃 这家 服务 不错 ,1,1
3931,74582725,10,中意 食 榴莲 人小 聚会 试试 榴莲 披萨 榴莲 菠菜 汁 炒饭 星爷 鸡翼 点餐 方式 真 新奇 ,1,1
3932,107377267,10,好吃 分量 行 ,1,1
3934,633706,10,环境 不错 分量 很足 ,1,1
3939,5527472,10,不错 ,1,1
3940,73798971,8,团购 套餐 实惠 成熟 扒 一份 一份 咬不动 小吃 炸豆 付点 酱 好吃 环境 挺 ,1,1
3941,633706,8,味道 不错 性价比 高 人太多 足足 半个 小时 位置 ,1,1
3943,5527472,8,味道 不错 重 口味 那种 下次 换种 口味 试试 ,1,1
3945,633706,10,朋友 吃 开心   扒 很大 一块   值   菜式   超值   服务员 态度 挺   周末 位子   上菜 特别   喜欢 吃 意面   还会 ,1,1
3946,73798971,5,还行 去过 两次 zzzzzzzzzzzzzz ,0,1
3948,107382571,10,不错 出品 先 说 生日 点 蛋糕 蜡烛 时 餐厅 响起 生日歌 时 感动 谢谢 ,1,1
3950,633706,6,环境 出品 ,1,1
3951,73798971,8,满意 性价比 高 1234 ,1,1
3954,74582725,9,喜欢 吃 榴莲   不错 ,1,1
3955,633706,10,牛扒 特别 特别 好吃 说不定 还会 再团 棒 ,1,1
3957,2501098,6,菜品 不错 排队 等位 时 已点 菜 入座 上菜 很快 ,1,1
3958,633706,8,老板 服务 不错 东西 好吃 ,1,1
3959,633706,10,第二次 环境 不错 味道 双人 餐吃 喜欢 蔬菜 沙拉 ,1,1
3961,633706,10,满意 ,1,1
3963,91361393,10,不错 服务员 加 泡菜 青菜 有效率 烤肉 不错 贵 ,1,1
3964,4739416,6,三文鱼 腩 刺身 太 正点 ,1,1
3966,4739416,10,味道 价钱 合适 重点 不用 等位 ,1,1
3968,73798971,10,真心 不错 不错 新开 性价比 高 环境 态度 味道 不错 铁板 吱吱 吱热 腾腾腾 还会 ,1,1
3970,633706,10,位置 好找 量 足 团购 两张 五人份 足量 喜欢 喝 汤 水果 沙拉 ,1,1
3971,2501098,9,味道 不错 服务 挺 价格 偏贵 分量 偏少 ,1,1
3972,2501098,9,吃 麻辣 香锅 味道 份量 还好 吃 完 水果 送 ,1,1
3973,5527472,10,太赞 味道 ,1,1
3974,73798971,6,味道     说     环境 价格 ,1,1
3975,158754521,6,味道 行 双人 套餐 两个 吃 ,1,1
3980,633706,10,份量 挺足 丸子 好吃 老公 说 牛扒 不错 鸡 扒 口感 稍微 差点 总体 挺 ,1,1
3982,5638032,10,挺 上菜 西北 味道 棒棒 哒 ,1,1
3983,5527472,6,好吃 环境 服务 行 优惠 点 ,1,1
3984,73798971,6,不错 实惠 朋友 喜欢 吃饭 ,1,1
3985,2501098,10,同事 三个 人点 两百多 醉 第三次 ,1,1
3987,633706,9,东西 不错 三个 趴 分量 很足 面包 不错 好吃 水果 沙拉 不赖 汤 好喝 改进 不错 第二次 ,1,1
3988,633706,10,价格 实惠 两个 吃 吃不完 下次 ,1,1
3989,119357852,10,行 ,1,1
3991,109403441,5,味道 上菜 速度 价格 还行 ,0,1
3993,158754521,5,味道 行 蟹 好像 不太 新鲜 还好 饮料 推荐 酸梅汤 ,0,1
3995,5527472,10,服务态度 不错 口味 全国 ,1,1
3997,109403441,10,美味可口 强烈推荐 ,1,1
3998,90908955,10,猫 ,1,1
3999,2501098,10,爱 吃 辣 爱 热闹 ,1,1
4000,2501098,9,位置 好找 北京路 天河城 楼 店员 服务态度 热情 帮 倒好 茶 小吃 赠送 抢 代金券 四个 一共 吃 202 两张 券 价格 挺 划算 公道 味道 不错 适合 广州 口味 我点 蒜 香 烤鱼 斤 分量 很足 炒饭 好吃 杂锦 酱油 炒饭 味道 好吃 挺 一家 店 ,1,1
4001,158754521,9,地方 好找 上菜 速度 分量 足 两个 吃 ,1,1
4002,164166476,6,好吃 发货 ,1,1
4004,633706,10,沙拉 难吃 不错 汤 好喝 ,1,1
4007,633706,10,团购 此种 套餐 一如既往 喜欢 菜品 口味 不错 猪扒 鸡 扒 烤 正到 火候 相 比较而言 鸡 扒 味道 配得 猪扒 更胜一筹 服务态度 几个 年轻人 彬彬有礼 感觉 亲切 环境 挤 办法 寸土寸金 地头 ,1,1
4010,73798971,7,环境 幽雅 ,1,1
4011,73798971,9,不错 第二次 ,1,1
4012,164166476,10,nice 味道 棒棒 哒 北京路 站 ,1,1
4013,74582725,10,正 去过 榴莲 炒饭 最赞 ,1,1
4014,73798971,8,九有 吃 一家 来到 北京路 光明 广场 这家 店面 环境 牛扒 不失 小吃 甜不辣 好吃 饮料 一般般 地段 性价比 高 ,1,1
4016,158754521,10,不错 份量 很足 下次 还会来   招牌 肉蟹 煲 ,1,1
4017,633706,9,量足 菜 快餐 吃 西餐 氛围 ,1,1
4018,109403441,9,环境 双人 套餐 吃 很饱 味道 不错 ,1,1
4019,5527472,9,比较满意 服务 味道 ,1,1
4021,633706,10,不错 味道 挺 人不多 服务 不错 挺 满意 ,1,1
4022,107377267,10,好吃 环境 ,1,1
4024,73798971,10,朋友 吃 好找 光明 吃 偏僻 环境 不错 稍微 点点 油烟 扒类 好吃     朋友 吃 饱饱 ,1,1
4025,73798971,10,第一次 挺 满意 环境 服务 挺不错 环境 暗暗 蓝蓝的 挺多人 位置 够 不用 等位 上菜 挺快 图片 拍 牛扒 汤 饮料 没拍 薯条 豆腐 豆腐 酱 好吃 牛扒 沙朗会 好吃 点 喜欢 冻 柠茶 温馨 提示 穿 白色 衣服 吃 牛扒 油 溅 衣服 ,1,1
4026,74582725,8,,1,1
4028,5638032,8,骨架 好吃 价格比 面点 王 稍微 贵 点 酸菜鱼 海带 酸菜鱼 特别 鲜 一般般 粥 真心 不错 3.99 一碗 划算 ,1,1
4029,2501098,10,价格合理 味道 不错 咸 ,1,1
4035,5527472,10,不错 喜欢 味道 不错 好评 ,1,1
4036,4739416,10,食材 新鲜 味道 不错 值得 购买 ,1,1
4037,73798971,6,吃 几次 套餐 不错 ,1,1
4038,5638032,10,爱 地方 发现 团购 太 开心 结账 超 100 团 现金 券 环境 感觉 干净 出品 味道 不错 优惠 ,1,1
4040,633706,10,好吃   环境 不错   份量 足   超级 好吃   赞赞 赞赞 ,1,1
4042,633706,10,不用 久 鱼排 出乎意料 好吃 包子 特别 好吃 美味 东西 不错 环境 挺 闷热 上菜 挺快 几个 小伙伴 围 吃 热闹 地方 特别 好找 吃 完 凉凉的 商场 里 逛逛 特别 棒棒 哒 推荐 ,1,1
4044,90908955,10,超级 棒 ,1,1
4046,633706,8,逛 正好 吃 牛排 价格 实惠 ,1,1
4048,107377267,8,蟹 味道 不错 ,1,1
4049,2501098,8,不错 一家 店 特别 喜欢 烤鱼 推出 新 口味 每种 吃 遍 吃腻 有幸 抽中 吃 霸王餐 不枉 热衷 北京路 这家 店 喜欢 服务员 热情 饭后 水果 赠送 小朋友 还会 送点 水果 我家 小宝贝 真心 谢谢 ,1,1
