,id,star,comment,sentiment,snlp_result
9898,4739416,6,人不多   上菜 速度   味道 ,1,1
9899,633706,10,妈妈 生日 全家 吃 老板 服务 热情 家 饭量 很大 吃 很饱 味道 棒极了 台湾人 台湾 菜 厚道 ,1,1
9903,73798971,10,环境 ,1,1
9905,633706,10,不用 说 字 好好 好好 好好 去过 喜欢 ,1,1
9908,73798971,4,快餐店 吃快餐 样子 ,0,1
9909,73798971,8,东西 份量 很足 平日 便宜 挺 划算 ,1,1
9910,633706,9,好吃 第二次 咯 上餐 很快 ,1,1
9912,2501098,10,不错 ,1,1
9914,2501098,8,第二次 吃 味道 不错 下次 有空 ,1,1
9915,5638032,10,环境   干净   服务 热情   味道 更是 没得说   吃 面食 好去处 ,1,1
9916,95652015,10,行 朋友 手背 抓伤   猫咪 环境 不错 行 朋友 手背 抓伤   猫咪 环境 不错 行 朋友 手背 抓伤   猫咪 环境 不错 行 朋友 手背 抓伤   猫咪 环境 不错 行 朋友 手背 抓伤   猫咪 环境 不错 行 朋友 手背 抓伤   猫咪 环境 不错 ,1,1
9917,633706,2,食品 比前 差 太度 环境 ,0,1
9919,164166476,2,服务员 态度 差 热情   吃 开心 份量 少 ,0,1
9920,633706,10,不错 下次 朋友 ,1,1
9921,5638032,6,,1,1
9922,2501098,10,,1,1
9923,107377267,5,口味 ,0,1
9924,92159107,10,下午茶 真的 超值 下次 还会 ,1,1
9925,633706,10,不错 ,1,1
9926,73798971,9,小菜 特色 牛肉 菜品 性价比 不错 喜欢 环境 设计 服务态度 友善 ,1,1
9927,74582725,9,大爱 榴莲 味道 不错 菜品 ,1,1
9928,2501098,10,挺好吃 下次 还会 正宗 味道 ,1,1
9929,633706,10,还行     分量 足     环境     不用 排队 ,1,1
9930,4739416,10,不错 划算 ,1,1
9931,73798971,10,一如既往 好吃 味道 很赞 能加 十元 加大 给力 ,1,1
9932,633706,6,上菜 很快   半个 小时 完菜 吃 完 hhhhh ,1,1
9934,633706,10,份量 很足 两款 扒 超大 餐包 奶 黄 好吃 双人 座位 挤 点 舒服 ,1,1
9935,633706,10,口味 上菜 很快 服务态度 ,1,1
9936,5527472,6,回家 吃 鱼 回来 点评 感觉 食物 配料 赶赶 料足 拉面 不错 ,1,1
9937,5527472,10,口味 服务员 态度 环境 不错 排队 人太多 ,1,1
9938,73798971,8,牛扒 罗宋汤 酸 柠檬茶 ,1,1
9939,633706,10,划算 正点 团 分量 很足 很大 块 很饱 ,1,1
9940,5527472,10,便宜 实惠 ,1,1
9941,633706,8,不用 排队 上菜 特意 还行 ,1,1
9943,73798971,10,好吃 好吃 棒棒 哒 机会 下次 ,1,1
9944,633706,10,服务周到 一座 茶水 面包 牛扒 沙拉 饮料 香芋 丸子 汤 每道菜 味道 可口 材料 新鲜 下次 朋友 ,1,1
9945,179651967,2,好吃   那种       真心 推荐 ,0,1
9947,633706,10,挺好吃 ,1,1
9948,179651967,10,味道 套餐 划算 服务员 老板 态度 特别 热情 很棒 体验 还会来 ,1,1
9949,158754521,8,下次 广州 还来 推荐 ,1,1
9951,5527472,10,好吃 环境 菜 新鲜 东西 吃 很饱 ,1,1
9953,5638032,8,菜 味道 环境 服务态度 不错 ,1,1
9955,633706,9,牛排 不错 味道 贵 99 元团 不错 ,1,1
9956,86045,10,菜品 味道 真心 推荐 越南 菜 吃 这家 味道 算 市内 一流 ,1,1
9957,5638032,10,吃 舒服 家乡 味道 每次 家里 朋友 喜欢 吃 ,1,1
9959,2501098,10,服务 热情 味道 超级 好吃 爱 烤鱼 鱼 新鲜 ,1,1
9962,2501098,10,环境 香 辣味 一半 菜式 好少 ,1,1
9963,5638032,8,还好 吃 菜 酸菜鱼 酱 骨架 话梅 排骨 好吃 土豆 太 腐竹 特别 好吃 必点 铁板 水晶 粉 喜欢 包菜 占 三分之二 节假日 没菜 京酱 瘦肉 北京烤鸭 感觉 ,1,1
9964,633706,2,真的 感觉 真的 东西 吃 ,0,1
9966,633706,10,朋友 味道 不错 ,1,1
9967,2501098,10,第八次 喜欢 烤鱼 好吃 ,1,1
9968,119357852,10,好吃 ,1,1
9969,633706,10,味道 不错 挺好吃 分量 很足 感觉 下次 还会 不错 餐厅 ,1,1
9970,164166476,10,环境 挺 服务 不错 ,1,1
9972,73798971,8,团购 实惠 三个 人去 单点 焗 饭 腻 吃不完 团购 挺不错 甜不辣 小吃 挺不错 吃 周末 加多 10 块钱 环境 挺 适合 约会 情侣 吃 台湾 小吃 甜不辣 ,1,1
9974,5638032,10,五星 好评 九毛 山西 面馆 光明 广场 店 点个 赞 强烈推荐 风雨 挡 台风 照样 闺蜜 吃 喜欢 吃 面条 酱骨 酱骨 好像 中药味 制作 一块 入味 干锅 杂酱面 油 油少点 喜欢 喝 荞麦 茶 香香的 吃 完 喝点 茶 刮油 环境 不错 还会 ,1,1
9975,73798971,8,牛排 不错   罗宋汤 好喝   甜不辣 好吃   炸豆腐 好吃 ,1,1
9977,90908955,8,萌宠 特别 专业 ,1,1
9978,5527472,10,挺好吃 人多 等位 稍 贵 ,1,1
9979,5527472,8,环境 服务 一对一 真的 很赞 嘻嘻 卫生 干净 希望 越做越 ,1,1
9980,2501098,10,分量 很足 味道 特别 感受 辣 值得 品尝 ,1,1
9982,73798971,8,味道 不错 牛排 份量 很足 西冷 牛排 筋 点 嚼 不到 ,1,1
9983,158754521,10,服务员 热情 好吃 环境 特别 推荐 ,1,1
9986,107377267,10,味道 不错 服务态度 机会 ,1,1
9987,73798971,4,口味 鱿鱼 难吃 份量 ,0,1
9991,73798971,10,回去 吃 团购 餐 超值 超值 人均 40 不用 吃 两个 牛排 两杯 冰沙 两个 小吃 两个 开胃 汤 甜不辣 换成 薯条 还好 喜欢 店面 挺大 人流 等位 上菜 挺快 服务员 态度 不错 ,1,1
9992,107377267,8,酱料 甜 ,1,1
9993,5527472,10,黄记煌 不错 味道 量 足 ,1,1
9994,5638032,10,还行 味道 老少皆宜 喜欢 老醋 味道 黑乔麦 茶 ,1,1
9996,633706,8,第二次 吃   牛排 分量   还点 一份 羊肉串 感觉 很骚 挺不错 ,1,1
9998,633706,8,一段时间 给力 东西 环境 不错 ,1,1
9999,633706,8,牛排 不错 小吃 真的 算是 对得起 价钱 ,1,1
10002,2501098,10,菜品 味道 不错 本来 喜欢 吃 烤鱼 吃 还行 ,1,1
10003,109403441,10,喜欢 几十次 ,1,1
10004,73798971,10,环境     菜品 ,1,1
10005,5638032,10,吃 完 久 忘记 评价 回忆 吃 面食 确实 不错 ,1,1
10006,5638032,10,味道 不错 感觉 还好 服务 耶 不错 ,1,1
10007,5638032,10,不错 吃 很饱 味道 价格 适中 ,1,1
10008,164166476,8,老公 广州 旅游 店家 地点 易 找 地铁 新装修 店内 环境 摆设 美 干净 卫生 点 美团 蟹 煲 套餐 先上 小菜 青瓜 萝卜 冻冻 好吃 开胃 不错 再来 柑桔 饮品 酸酸甜甜 不错 大杯些 更好 主角 终于 出场 大盘 肉蟹 煲 份量 很足 点 辣味 只蟹 配上 鸡脚 款 蔬菜 味道 不错 只蟹 只蟹 肉质 松散 软烂 进店 下单 前 问 次 服务员 活蟹 说 活蟹 吃 蟹 死 一段时间 肉质 失望 吃 惯 新鲜 蟹 知 很大 差别 幸好 只蟹 新鲜 实肉 弹性 汤汁 鸡脚 份量 盘底 粟米 很甜 好吃 ,1,1
10009,86045,8,服务 菜式 少点 ,1,1
10010,2501098,10,幸运 抽到 霸王餐 少 东西 吃不饱 吃 撑 先不说 东西 好不好 吃 服务 真的 一流 热情 周到 主动 帮忙 倒 茶 点 汽水 主动 杯子 倒 汽水 主动 送上 免费 西瓜 买单 点菜 主动 喊过 服务员 抽奖 特别 我见 一桌 说 说 菜品 凉粉 真的 太合 口味 吃 几口 烤鱼 真的 超级 好吃 烤 焦香 蒜 香 一点点 辣味 味道 好极了 配菜 豆芽 青瓜 不错 建议 青瓜 早点 吃 软 好吃 原价 100 不贵 团购 会常来 吃 ,1,1
10012,172239782,10,口味 清淡 油腻   口味 微辣 适合 不太能 吃 辣 人群 健康 口味 吃 刚刚 份量 足   性价比 高 吃 扶 ,1,1
10013,633706,8,味道 环境 ,1,1
10015,73798971,10,量 环境 优雅 服务态度 经济 实惠 ,1,1
10017,633706,6,份量 很足 味道 服务 太态 不错 ,1,1
10018,2501098,4,量 太少 感觉 贵 划算 服务 ,0,1
10020,73798971,10,越来越 便宜 味道 不错 喜欢 玉米汤 ,1,1
10021,5527472,10,牛蛙 真心 好吃   辣 好吃 ,1,1
10022,107382571,10,环境 评论 价格 行 不错 ,1,1
10023,2501098,10,全家人 吃 老人 小孩 吃 开心 下次 值得 推荐 ,1,1
10025,4739416,8,味道 紫薯 布丁 紫薯 布丁 ,1,1
10026,117225790,10,挺 划算 炒蛋 三明治 好评 ,1,1
10028,86045,8,北京 路口 地铁站 潮楼 旁 晚上 满座 人点 八个 菜 上菜 挺快 味道 炒 花甲 大部份 壳 没什么 肉 喜欢 火车头 粉 烤肉 不错 很松化 美团 买单 折扣 挺 ,1,1
10029,86045,10,味道 不错 ,1,1
10030,73798971,4,牛扒 薯条 软 柠檬茶 喝 最难 ,0,1
10031,5527472,8,味道 特别 坐 十多分钟 人理 难过 味道 挺 ,1,1
10032,86045,6,彩牌 菜 选择 少 口味 价格 北京路 算 适中 起码 不用 等位 ,1,1
10033,5527472,8,菜品 可口 上次 吃 咸了 味道 棒 环境 服务 态度 ,1,1
10034,5527472,10,希望 勇于 团购 赞 ,1,1
10035,5527472,4,还好 点错 味道 特别 好吃 ,0,1
10036,2501098,8,夫妻 肺片 好吃 下次 试下 蒜泥 白肉 ,1,1
10037,74582725,8,挺不错 一家 餐厅 位置 挺 好找 光明 广场 旁边 整体 味道 挺不错 蛋挞 差 点 皮 不用 用蛋挞 皮 做 吃 太好 口感 披萨 挺不错 罗马 蔬菜 沙拉 有趣 两人餐 吃 不错 下次 ,1,1
10039,2501098,10,不错 120 多块 吃 撑不住 赞 ,1,1
10040,86045,10,爱 吃 棒 还会 爱 芝士 火锅 ,1,1
10041,633706,8,  用美团 服务   问 成熟   酱汁   用美团     好吃   推荐 ,1,1
10045,633706,8,中规中矩 扒 挺大 两个 女孩 东西 吃不完 服务态度 ,1,1
10046,86045,10,就系 北京 潮流 隔离 二楼 晚上 食 唔 唔 位置 环境 算 干净 坐低 唔 耐 上菜 咖喱 牛腩 味道 d 辣 椰汁 糕 超好味 手 撕鸡配 青柠 味道 特别 沙律 炸虾 七八只 分量 太 少 感觉 唔 底 ,1,1
10047,73798971,6,这家 西湖路 光明 广场 三楼 占地 装修 不错 位置 挺 宽敞 点 海鲜 芝士 焗 意粉 汕头 炒饭 鱿鱼 筒 蒜 香鸡 中翼 汕头 炒饭 虾 鱿鱼 炒 配料 炒得 挺 香 海鲜 芝士 焗 意粉 青口 鱿鱼 味道 鱿鱼 新鲜 鱿鱼 筒 煮 点 酱油 有嚼头 味道 总体 行 环境 不错 价格 经济 ,1,1
10049,73798971,8,环境 不错 周末   so   不用 排队     服务     美团   团 美 ,1,1
10051,73798971,10,经济 实惠 味道 不错 值得 品尝 ,1,1
10052,633706,8,环境 舒适 服务 挺 味道 不错 ,1,1
10053,156593954,10,性价比 不错 面 口感 味道 虾大个 新鲜 奶油 蘑菇 汤 蘑菇 味道 浓郁 有大个 大个 蘑菇 良心 值得 店 座 阳台 情调 ,1,1
10056,2501098,10,不错 感觉 太辣 微辣 辣 满意 妈妈 ,1,1
10057,107377267,8,吃   优惠   味道 不错   一如既往 选择   配 饮料 ,1,1
10060,5527472,10,不错 ,1,1
10061,158754521,5,口味 ,0,1
10066,73798971,8,去过 几次 真的 不错 ,1,1
10067,73798971,8,环境 不错 舒适 交通 粟米 汤比 罗宋汤 好喝 好多 罗宋汤 好难 喝 果汁 变冰沙 果汁 挺 红枣 茶 柚子茶 好喝 牛扒 不错 意粉 太 硬 有饭 薯泥 选择 两个 份量 足 吃不饱 ,1,1
10070,5527472,10,不错 哈哈哈哈 哈哈哈 哈哈哈 哈哈哈 哈哈哈 ,1,1
10072,633706,6,粟米 汤 唔 饮 扒系 大件 接受 餐包 无言 柠乐 屋企 整仲好 佢 仲要 18 蚊 ,1,1
10074,633706,10,好吃 量 足 ,1,1
10076,73798971,10,女朋友 说 牛排 好吃 下次 吃   ノ 自助 水果 沙拉 nice ,1,1
10078,5527472,8,喜欢 好吃   喜欢 吃 特辣 香 ,1,1
10079,73798971,10,挺好吃 喜欢 性价比 高 喜欢 ,1,1
10080,73798971,10,味道 服务 周到 环境 挺 喜欢 ,1,1
10081,2501098,6,味道 不错   服务员 态度 友好   还会 ,1,1
10083,633706,8,晚上 点 几座 服务 口感 行 ,1,1
10084,633706,6,环境 服务态度 口味 推荐 ,1,1
10085,158754521,10,份量 挺足 味道 很鲜 感觉 性价比 挺 高 下次 广州 尝试 ,1,1
10086,73798971,10,位置 好找 挺 热闹 关键 份量 足 ,1,1
10087,5527472,10,好吃 朋友 聚会 吃 满意 ,1,1
10090,633706,10,还好 上菜 挺快 ,1,1
10091,633706,10,  支持 ,1,1
10092,73798971,6,味道 不错 八分熟 牛扒 鲜甜 哈哈哈哈 哈哈哈 ,1,1
10096,2501098,8,挺好吃 三个 人点 泡椒 烤鱼 一份 香锅 两个 男生 女生 吃饱 烤鱼 味道 真的 不错 肉质 鲜嫩 香锅 还行 感觉 不划算 菜 贵 一点点 一共 花 230 块 店家 服务态度 挺 送 薯片 西瓜 凉菜 服务 挺 ,1,1
10098,4739416,10,料 足 上菜 味道 棒 东西 不贵 ,1,1
10099,164661961,8,挺不错 男朋友 胃口 吃 ,1,1
10100,2501098,10,几次 喜欢 家 夫妻 肺片 每次 必吃 旺旺 烤鱼 个人感觉 不辣 ,1,1
10102,633706,8,不错 吃 ,1,1
10103,633706,8,上次 好吃 牛排 用料 不太好 难切 筋 ,1,1
10105,109403441,10,牛肉 新鲜 味道 服务态度 一流 不错 好评 ,1,1
10106,73798971,8,牛扒 味道 环境 安静 舒服 自助 水果 新鲜 一点 小虫 飞来飞去 ,1,1
10108,74582725,10,服务 周到 味道 不错 ,1,1
10109,73798971,10,不错 分量 很足 环境 不错 团购 划算 吃 很饱 满意 值得 常去 北京路 好找 两次 周末 加收 钱 扒 味道 不错 两个 扒 好吃 薯条 好吃 玉米汤 很浓 芝士 味 罗宋汤 油 喜欢 玉米汤 ,1,1
10110,633706,6,只想 说 茶 鸡柳 沙拉 吃 完 喜欢 ,1,1
10111,107377267,10,棒 漂亮 小姐姐 ,1,1
10112,73798971,10,价钱 便宜 牛扒 成熟 煮 味道 正 环境 幽静 值得 一去 ,1,1
10113,633706,4,牛排 太老     带有 酸味       图片 仅供参考 ,0,1
10114,633706,8,  西餐 吃饭   分量 足 ,1,1
10116,73798971,10,不错 环境 下次 再来 吃 ,1,1
10117,73798971,6,东西 味道 不错 两个 几十块 便宜 机会 试试 ,1,1
10118,74582725,8,特意 吃 榴莲 披萨 味道 不错 ,1,1
10119,86045,10,不错 几次 ,1,1
10120,633706,8,拍 图片 可惜 服务 周到 牛排 挺不错 尝试 ,1,1
10121,74582725,8,几次 真的 不错 榴莲 味 重 浓郁 喜欢 清新 绿色 值得 一而再 再而三 ,1,1
10123,73798971,10,几次 不错 ,1,1
10124,633706,8,去过 几次 真的 划算 两个 女孩子 吃 吃不完 团购 鸡 扒 牛扒 牛扒 服务员 态度 满意 走近 店门口 有人 带进去 热情 招呼 上菜 舒服 很快 有时候 还会 光顾 ,1,1
10125,73798971,8,不错 第二次 ,1,1
10126,169458693,10,沐足 吃饭 沐 足 对面 团购 鸡 套餐 单点 青菜 没吃过 一种 野菜 好吃 第一次 鸡肉 很嫩 蒸鸡 全是 肉 骨头 锅 熬汤 汤 特别 浓 好喝 鸡肉 特别 嫩 生 鸡肉 蒸到 蒸汽 吃 鲜 虫草 花 白贝 红枣 蒸 甜甜的 滑滑 值得 品尝 ,1,1
10127,633706,10,父亲节 带爹 妈咪 食   第一次 食   爹地同 男朋友 满意   环境 唔 错   抵食   味道   分量 足   就系 甘岩 果晚   大夏 中央空调 坏   店铺 应急 措施   食得 热   接近 九点   忌廉 罗宋汤   遗憾 ,1,1
10128,5527472,10,环境 不错 找 服务态度 说 重 口味 真的 加 酱汁 口味 淡 朋友 吃 吃 愉快 浪费 一共 219 团购 两次 100 代金券 现金 补 差价 值得 推荐 ,1,1
10129,73798971,10,花街 第一天 超多人 排队 拍 小时 空桌 团 两份 双人 套餐 店员 推荐 成熟 10 块 升级 大排 厚 环境 值得 推荐 ,1,1
10132,5527472,10,吃 花 张券 加 56 元 不错 服务 问 点 一轮 建议 先 吃 再点 服务态度 满意 ,1,1
10133,5527472,10,偏甜 ,1,1
10134,73798971,10,牛排 好吃 服务态度 环境 OK ,1,1
10135,86045,10,味道 不错 代金券 划算   味道 不错 代金券 划算   味道 不错 代金券 划算   味道 不错 代金券 划算   味道 不错 代金券 划算 ,1,1
10137,633706,6,昨天 朋友 分量 很足 牛排 成熟 做 吃 T 字排 过熟 面 不错 ,1,1
10142,179658375,10,正宗 好吃 鸡 汤 配料 一级 棒 ,1,1
10144,2501098,10,味道 口感 越南 风味 下次 再束 ,1,1
10145,2501098,10,不错 喜欢 麻辣 香锅 烤鱼 味道 ,1,1
10146,4739416,10,赞 ,1,1
10147,73798971,8,价格 实惠 环境优美 服务周到 希望 ,1,1
10148,5527472,10,口味 不错 真的 口味 不错 位置 好找 ,1,1
10149,73798971,10,挺 次 服务员 热情 ,1,1
10150,633706,10,环境 不错 份量 算 足够 出品 真的 ,1,1
10151,86045,10,好吃 不错 ,1,1
10152,633706,8,很棒 上菜 很快 服务 食物 很足 分量 环境 清新 感觉 睇 落 简洁 环境 自然 吃 嘢 愉快 好多 牛扒 很嫩 入味 吃 几香 有个 雪花 扒 吃 几好味 但系肥 咗 小小 粟米 汤 好喝 口味 ,1,1
10154,633706,6,几次 环境 味道 还行 ,1,1
10155,633706,6,菜 味道 服务 挺 周到 ,1,1
10158,4739416,8,口味 不错 每次 不用 排队 打包 用心 ,1,1
10160,2501098,10,量 两个 吃不完 不错 ,1,1
10163,5527472,6,环境 口味 都行   份量 少   价格 高 ,1,1
10165,2501098,6,感觉 烤鱼 好吃 蓝莓 山药 棒棒 ,1,1
10166,2501098,4,挺好吃 够 辣 爱 吃 辣 推荐 价格 算 实惠 ,0,1
10167,633706,8,牛扒 鸡 扒 味道 不错 汤和餐 包 环境 不错 总体 挺 ,1,1
10168,633706,8,位置 稳 扒 大件 抵食 点 左个 套餐 ,1,1
10171,74582725,4,出品 好吃 下次 感觉 榴莲 pizza 乐 凯撒 好吃 出品 一般般 榴莲果 泥 不错 ,0,1
10173,5638032,6,味道 不错 服务 还行 客人 太 上菜 慢 感觉 人员 充足 毛 内部 调动 ,1,1
10174,4739416,8,食物 团购 不值 服务 挺 主动 水 感觉 分量 好少 吃不饱 ,1,1
10175,164166476,10,环境 不错 味道 ,1,1
10177,5527472,10,菜品 不错 丫 环境 不错 ,1,1
10180,633706,8,团购 双人 餐 儿子 加 焗 面 太多 吃不完 餐就够 儿子 吃 开心 牛排 行 肉 火候 够 不错 搭配 意面 好吃 点 好吃 儿子 吃 完 套餐 水果 桌 点 分量 很足 店里 148 双人 餐 消费 满减 算下来 团购 早 不用 等位 下次 ,1,1
10181,92159107,10,好吃 榴莲 点 肉骨 茶 不错 ,1,1
10182,73798971,10,不错 ,1,1
10183,73798971,10,真的 超好 东西 好吃 服务 超好 超级 棒 ,1,1
10184,2501098,10,喜欢 麻辣 很香 很够 位 ,1,1
10185,5527472,10,黄骨鱼 够 新鲜 服务员 太度 赞 还会 米 ,1,1
10186,95652015,10,挺不错 几个 祖宗 老公 外套 祖宗 一人 撒 一团 尿 -_- 回家 穿 那件 衣服 做 小时 地铁 ,1,1
10187,4739416,10,味道 挺不错 价格 实惠 两个 人点 四个 够吃 同伴 好几个 菜色 想 吃 下次 ,1,1
10188,5527472,10,一如既往 ,1,1
10189,158754521,10,好吃 蟹 肥 入味 团购 划算 送 小吃 送 饮料 ,1,1
10191,4739416,8,划算 家里 没饭 吃 不用 等位 ,1,1
10192,4739416,10,价好 抵 分量 足 值得 试试 ,1,1
10194,73798971,8,环境 不错   挺     OK ,1,1
10196,5527472,4,希望 多些 菜品 ,0,1
10197,159146980,8,出品 环境 干净 地面 不滑 吃 身 火锅 味道 ,1,1
10199,2501098,10,北京路 很值 量足 味道 ,1,1
10201,633706,10,两人 套餐 吃 很饱 味道 不错 分量 足 ,1,1
10202,74582725,4,榴莲 冰冻 吃 腻 柠檬茶 差评 涩 真心 好喝 ,0,1
10203,633706,10,挺不错 出品 ,1,1
10204,73798971,6,牛排 分量 足够 吃饱 罗宋汤 好难 喝 咸 酸 冬瓜汤 不错 ,1,1
10205,633706,10,不错 挺 性价比 行 牛排 挺大 ,1,1
10207,164409108,8,味道 不错 贵 点 ,1,1
10210,5638032,10,价格 优惠 光明 广场 吃 过年 菜 感觉 味道 ,1,1
10212,73798971,10,口味 不错 价格 实惠 适合 情侣 约会 地点 ,1,1
10214,73798971,10,超棒 地方   服务 不错   味道 超棒 ,1,1
10215,633706,10,服务 东西 不错 下次 ,1,1
10216,74582725,10,好吃 爱 吃 榴莲 味 下次 还会 ,1,1
10217,158754521,10,味道 不错 两个 吃 饱饱 ,1,1
10218,2501098,9,大盘 味道 不错 辣椒 挺 ,1,1
10220,633706,8,挺 排 很大 感觉 不错 ,1,1
10222,73798971,10,挺 朋友 两次 服务 不错 ,1,1
10225,73798971,10,好好 平靓 正 70 双人 餐 两个 吃 撑 ,1,1
10227,633706,10,态度 味道 下次 还会 ,1,1
10228,633706,10,挺 ,1,1
10230,5527472,10,环境 不错 吃 还会 ,1,1
10231,633706,8,总体 行 ,1,1
10234,2501098,8,味道 不错 两个 吃 一百多 撑 ,1,1
10235,633706,8,n 次 吃 量 很足 味道 喜欢 吃 团 人餐 人餐 吃不完 剩下 好多 小餐 包被 表妹 拿来 夜宵 ,1,1
10236,633706,10,女朋友 吃 挺 情调 水果 拼盘 真的 很大 菜 ,1,1
10240,2501098,10,挺 分量 很足 两个 吃不完 ,1,1
10241,5527472,10,份量   味道 不错   环境 挺 ,1,1
10242,2501098,10,第四次 吃 辣尚瘾 确实 挺不错 烤鱼 口味 选择 重点 烤鱼 新鲜 肉质 很嫩 入味 位置 好找 天河城 百货 七楼 平时 北京路 逛街 吃饭 服务到位 一点 更好 第一次 写 评论 ,1,1
10243,5527472,10,满意 好吃 下次 想 吃 ,1,1
10244,633706,4,感觉 价位 食物 匹配 价格 绿茵阁 拼 味道 差 远 面筋 小吃 不错 ,0,1
10245,159146980,6,品种 少 点 行 ,1,1
10246,86045,10,口味 棒棒 哒 ,1,1
10249,4739416,10,喜欢 饭 鳕鱼 ,1,1
10250,633706,5,还行 味道 环境 不错 团购 份量 足够 想象 中 好吃 ,0,1
10252,73798971,10,不错 牛扒 成熟 吃 挺好吃 黑椒 汁 赞 ≧ ▽ ≦ 刀 好切 周五 不用 等位 店面 挺大 灯光 蓝色 拍 照片 有点像 club 里 拍 感觉 服务 不错 推荐 炸豆腐 不错 ,1,1
10253,164166476,10,环境 服务员 菜品 棒 ,1,1
10254,5527472,4,  墨鱼 苦   行   好评 ,0,1
10255,73798971,10,味道 不错 上菜 服务 挺 两个 吃 饱饱 ,1,1
10257,5527472,6,上菜 服务 餐厅 环境卫生 不错 还会来 ,1,1
10258,633706,10,第二次 位置 好找 一出 电梯 真的 好吃 两人 吃不完 适合 家人   闺蜜   约会 地点 强烈推荐 ,1,1
10259,633706,8,不错   味道 一如 从前 希望 创新 ,1,1
10260,633706,6,点 99 元 双人 套餐 环境 oK 份量 充足 牛扒 囗 感尚 沙律 ,1,1
10261,2501098,10,味道 去过 特别 烤鱼 囋 ,1,1
10264,2501098,8,烤鱼 味道 没话说 赞赞 赞赞 赞赞赞 ,1,1
10266,2501098,6,鱼 咸 好多 分量 很足 吃 吃 很饱 ,1,1
10269,4739416,6,还好 老公 话 ╮ ╯ ▽ ╰ ╭ ,1,1
10272,179453956,4,肉 煮烂 很韧 难 啃 特色 比不上 重庆 鸡公 煲 ,0,1
10273,73798971,10,环境 不错 闺蜜 两个 吃饭 聊天 ,1,1
10275,158754521,10,份量 足 气氛 蜡烛 火 稍微 再大 点火 总体 不错 ,1,1
10276,2501098,10,,1,1
10278,73798971,8,吃 分量 很足 牛排 差 点 行 ,1,1
10279,633706,8,味道 不错 上菜 速度 团购 套餐 冷得 东西 ,1,1
10280,73798971,8,环境 不错 服务 ,1,1
10281,633706,8,味道 不错 环境 份量 很大 两个 吃不完 ,1,1
10282,633706,10,味道 挺不错 吃 很饱 价格 挺 实惠 服务员 态度 ,1,1
10283,73798971,8,环境 挺不错 味道 行 扒量 挺足 ,1,1
10286,5527472,8,环境 不错 好多 味道 有点咸 ,1,1
10287,633706,10,满意 第三次 吃 ,1,1
10288,2501098,8,去过 味道 喜欢 ,1,1
10290,633706,8,牛排 确实 鸡排 好吃 不错 ,1,1
10291,633706,10,上菜 超级 速度 牛排 口感 不错 价格 偏高 ,1,1
10292,164166476,8,份量 味道 不错 ,1,1
10293,107377267,8,不错 每次 朋友 ,1,1
10297,5527472,10,口味 依然如故 喜欢 经济 实在 ,1,1
10300,73798971,10,环境 菜量 只能 说 味道 对得起 价 ,1,1
10303,5527472,8,味道 不错 特别 酱 真的 调得 环境 不错 ,1,1
10305,158754521,6,吃 我妹 朋友 吃 味道 喜欢 鸡爪 ,1,1
10308,2501098,10,烤鱼 味道 不错 服务员   态度 友善 就餐 环境 舒服 性价比 高 ,1,1
10310,164409108,10,位于 北京路 今半 食堂 日料 火锅 火锅 吃 日料 火锅 未试过 老公 想 试试 挺 等位 想试 朋友 早点 服务员 小姐姐 态度 ,1,1
10311,4205874,10,不错 一如既往 好吃 推荐 朋友 说好 下次 还来 ,1,1
10313,73798971,10,好吃 牛排 很大 份 很嫩 加大 小吃 好吃 甜不辣 日本 辣 豆腐 酸辣 甜甜的 玉米汤 甜 卖相 好看 餐厅 环境 调调 适合 情侣 音乐 听 位置 舒服 不用 排队 上图 下次 ,1,1
10314,107377267,10,好吃 ,1,1
10315,633706,8,口感 份量 很足 划算 ,1,1
10316,73798971,8,不错 价格 中等 人均 50 元 ,1,1
10317,5527472,10,真的 超级 好吃 满意 满意 超 满意 ,1,1
10320,73798971,8,牛扒 好味 芒果 冰沙赞 罗宋汤 唔 喜欢 ,1,1
10321,633706,10,分量 很足 味道 真的 不错 老板 热情 ,1,1
10322,633706,10,位置 好找   天河城 百货 楼     逛街   完美   上菜 舒服 超级   不用 等位   太好了 姐姐 两个 吃 很饱   老板   热情   很会 做生意   东西 好吃   丰盛     甜品 水果 牛排 馒头 好吃 ,1,1
10323,73798971,8,优惠 环境 团购 差别 ,1,1
10325,73798971,6,味道 够 东西 不错 ,1,1
10327,73798971,10,不错 值得 推荐 价格 划算 味道 行 ,1,1
10328,5527472,10,环境     代金券 挺 抵 ,1,1
10329,73798971,6,很棒 环境 舒适 上菜 很快 吃 很饱 ,1,1
10330,74582725,10,味道 确实 不错 第一次 找 地方 找 久 ,1,1
10331,5638032,10,100 块 八折 送 荞麦 茶 划算 ,1,1
10333,633706,8,环境 不错 挺 喜欢 ,1,1
10335,73798971,10,牛排 新鲜 味道 很鲜 分量 足 店 正中 中午 人不多 上菜 很快 服务 提前 告知 东西 需加 费用 两人 吃 很饱 豆腐 超级 好吃 要点 个赞 东西 太 好吃 忘记 拍照 吃 完   下次 ,1,1
10337,633706,10,环境 不错 服务态度 上菜 很快 ,1,1
10338,73798971,10,美团 积分 重要性 美团 积分 抵用 现金 时 这句 话 复制 走到 复印 充 数字 100 字 机会 拿走 100 积分 返回 正题 地方 好找 环境 很棒 好吃 榴芒 相恋 不错 好吃 ,1,1
10339,5527472,10,好吃 值得 推荐 逛街 累 吃 香喷喷 一锅 ,1,1
10341,73798971,10,好食 下次 食 不用 等待 ,1,1
10342,633706,8,量 环境 服务 菜品 味道 试试 吃 吃 ,1,1
10343,4739416,8,上菜 很快 店不大 环境 三文鱼 皮 好吃 花枝招展 盖饭 超级 棒 服务 法式 鹅 肝 真的 不错 ,1,1
10344,5527472,8,今日 爷爷 吃 牛蛙 锅配 海鲜 酱 爷爷 说 味道 不错 ,1,1
10345,2501098,10,服务 不错 环境 味道 不错 ,1,1
10346,633706,8,不错 下次 机会 还会 量 两个 吃得饱 ,1,1
